"Make only the entrances of the cave have torches to discourage Cave Camping as I call it.   The entrances are lit so both sides can find it, but inside is dark to give Ewoks an advantage.",2,Nexo42,dxkr9zf,2018-04-18 16:46:39,16,0
"I would love to see an order 66 mode based on this mechanic,also please make this new mode permanent",2,ectelion_,dxkuilf,2018-04-18 17:33:13,17,0
"I would love for this to be a permanent mode and for it to be expanded upon with more locations, factions, depth, etc. It is terrifying having only a few Stormtroopers remain then hear 10+ Ewok horns go off at the same time from different directions. ",2,Rimeraz,dxkux7l,2018-04-18 17:39:08,17,0
"I like that this game mode is something new. I like how the mechanics are different ie its in first person for the stormtroopers and you have a gun and a flashlight. Meanwhile, the ewoks have the ability to see through the dark and track you. This gives the game a much more suspenseful and urgent feel. This is perhaps my favorite game mode.",2,TripleTuck,dxkxa2x,2018-04-18 18:13:42,18,0
This is awesome I'm loving it. Really nice job Dice !!,2,BohemianSon,dxkxc94,2018-04-18 18:14:34,18,0
"Really fun, like others have said, I'd say aim to make more maps/similar ideas on other planets, enough to have a weekly playlist where it can alternate every 1/2 days, if that isn't viable, bringing it back on certain days or weekends I think would keep it fresh, because if it's a 24/7 mode, it will eventually get stale even if people don't want to admit that now.",2,dominic115,dxkyr0x,2018-04-18 18:35:16,18,0
"Put this on every map. I don't care about the lore. Make a variation of it, I don't know. But this is the kind of goofy, stupid fun I want to experience in this game. Just fun. I don't care if it doesn't make sense to have Ewok on Naboo or on the Death Star. The lore, it's good and it's cool. But it shouldn't be holding the game back. I'm sure you could find a way. Like Jawas for Tatooine, for exemple.   Also, it's been said a thousand times, but make this a permanent thing. It's, in my opinion, the best thing that has been added to this game.",2,NamelessWing,dxkzz0d,2018-04-18 18:52:58,18,0
"This is amazing.  the tension of being a stormtrooper in the dark.  the relief at finding a buddy.   Ewoks are terrifying little buggers, and when you die, I love the way the music comes on and intensifies as more stormtroopers fall.  So ominous!  Simply amazing.  Can't wait to play this with my friends.",2,Dai_Kaisho,dxl0ufi,2018-04-18 19:05:47,19,0
"The only suggestion I have is maybe to close the cave.  Every game I've played where the stormtroopers hide in there, they win with relative ease.",2,A_Ruse_Elaborate,dxl39td,2018-04-18 19:41:13,19,0
The cave could use some openings in the top so that the imperials can’t just watch the 3? Entrances to it this would give the opportunity for the attack from above,2,Aj_bary,dxl67sh,2018-04-18 20:24:09,20,1
It's too easy for stormtroopers to camp in caves and wait out the match.,2,Jacklessthanthree,dxl7ezv,2018-04-18 20:41:38,20,0
"It would be nice to have more reasons to go out and explore the map. Like more prominent pick ups or random drop pods, in order to get people out of that cave.",2,Mintaka90,dxl9nhr,2018-04-18 21:15:41,21,0
"I feel like the roll for the stormtroopers may be too powerful, it’s literally impossible to kill a roll spamming trooper with the main attack",2,Darth-Sand,dxlb837,2018-04-18 21:40:13,21,0
I love it my only piece of feedback is it’s quite boring when the troopers just hide in the cave. Maybe just remove the cave if it becomes permnanent ? ,2,sixesandsevenspt,dxlcy8h,2018-04-18 22:07:52,22,0
Please make it permanent the mode is amazing and a lot of fun I'd play it as much as GA or HvV its great,2,BotsShots,dxlf22y,2018-04-18 22:43:24,22,0
"This new mode was AWESOME! Love it! Reminds me of playing Aliens vs. Predator on LAN. It's nice as it is, but if you plan to expand on it, and I know this is highly unlikely, but it would be fun to have a Gorax wandering around, either as an AI or as a player. Other than that it would be fun to see more Ewok-weapons, more maps like the Hoth ice cave from BF2015, but with Wampas vs. rebels or imperials :D",2,Nimperedhil,dxlfy5h,2018-04-18 22:59:14,22,0
IT IS SO GOOD KEEP THIS PLEASE,2,space_beard,dxlk1by,2018-04-19 00:08:35,00,0
"Now Ewoks are more fleshed out with their own attacks, skills, and animations can you add them as an AI-controlled 3rd faction to relevant maps?   I remember the original BF games had Tusken Raiders and Geonosians running around some maps adding a bit of immersive flavour. Would be nice to see it return.",2,Oceanias,dxlwje4,2018-04-19 03:42:28,03,0
"This is the Aliens game I’ve been waiting forever for, and it’s with Ewoks.  Who knew? Lots of horrific fun! Now I understand why this esavage little fuckers won the Battle of Endor.",2,Bigoteroj,dxm08o7,2018-04-19 05:00:35,05,0
Please nerf the cave! 😁,2,RichardTDE,dxm0c42,2018-04-19 05:03:00,05,0
"Umm, not sure how this could be fixed but u/f8rge, I’ve found a way to get on the tree platforms as an imperial. I won’t post it here since that’s probably gonna cause chaos. ",2,albinolan,dxm29gx,2018-04-19 05:53:21,05,1
This is my favorite mode. I want to see Wampas v Rebels on a darkened Hoth. Tuskens vs Jawas on the Tatooine cliffs map from BF1.,2,jordanmilkyway,dxm78mg,2018-04-19 08:49:54,08,0
"We need more loadouts to pick up around the map, such as power ups such as health, weapons and abilities.it would be amazing if this becomes a popular mode to make different versions for the prequels and sequels such as order 66 in the Jedi temple (I can wish) and maybe hiding from kylo ren in the forest outside of Maz's castle EDIT- You already have maz's castle to us, it would be an easy to make mode",2,hornhonker1,dxm9nlu,2018-04-19 10:28:48,10,0
"It's great fun, but would be improved if the cave didn't have torches in it and, most importantly, either reduce Stormtrooper health or increase Ewok damage. At the moment it can be a bit frustrating starting off as a single Ewok.",2,olgr777,dxk9gpg,2018-04-18 11:43:36,11,1
"I think the mode is stupidly fun and additive. My feelings on what I don't like is stormtoopers can easily kill an Ewok with 2 melee presses. If you get hit just mash melee and win.   But what about using the horn? That's my other thought, it doesn't last long enough. If a dingus stormy is standing still fantastic get that easy kill. If they're running, you can't catch them and if somehow you do the horn has run out and you get punched twice and die.  One last Ewok thing is the spears from above feel reallly difficult to actually land. I get excited seeing a group of troopers are standing under the walkways I'll jump, I'll aim, I'll stab, I'll slide down their back and get gunned down.   My 2cents  Beyond that I will probably play this for the next week straight!",2,rebel181,dxkd6de,2018-04-18 13:08:06,13,2
Nerf the cave,2,RichardTDE,dxkkdbo,2018-04-18 15:06:45,15,0
"I feel like the map size is a little too big for the mode. Playing as an Ewok I feel like I'm running for too long to try and find an enemy. Also, Please make an Order 66 hunt mode in the future. Would love to see hunt modes across all eras",2,sithofthesenate,dxka09z,2018-04-18 11:57:45,11,0
Remove the cave system makes it pretty hard to kill the troopers ,2,Cyka_Blyatman,dxkpb11,2018-04-18 16:18:25,16,1
"I can understand limiting the Stormtroopers to First Person view in order to make it easier for the Ewoks, but why are there preset taunts? I kind of want to use my own for this gamemode.",2,greenearbud,dxkcozc,2018-04-18 12:58:29,12,0
"So here's a crazy idea: make a mode with battle droids v. Yoda. Maybe an elimination style game (or adding clones when droids die, but I think that might make Yoda OP). Imagine how terrifying it would be as a group of battle droids just waiting for that little green guy to slice you all to pieces at any moment. I don't really know how it would work mechanically, but I really like this concept.  Edit: more words",2,overthinker356,dxkeat1,2018-04-18 13:29:07,13,3
"Feedback - Incredibly fun as well as scary - unlike any star wars game I've played.  Something needs to be done about Stormies camping in the cave.  Would love to see other themed modes like this, eg for tusken raiders in night time mos eisley. Wampas on the night time hoth map with the ice caves from BF2015. Oh and order 66!  And...  MAKE IT PERMANENT!",2,alastairsnook,dxki33y,2018-04-18 14:32:14,14,0
I like it but it would be an improvement if the ewoks had throwable spheres and maybe give the stormtroopers more health regeneration.,2,KOFOLA007,dxkktai,2018-04-18 15:13:23,15,0
"I really love this mode and hope it's permanent.  Something has to be done about the cave, though.  It's way too hard to kill ST's in there.  ",2,stoolninja,dxku8ve,2018-04-18 17:29:17,17,0
I absolutely loved this mode. This game mode+ private matches = fun ,2,Halldark,dxkul8y,2018-04-18 17:34:18,17,0
Stop making these modes timed.   ,2,JustsomeBRITISHdude,dxkv70s,2018-04-18 17:43:07,17,0
Would love to see it added to Arcade too.,2,iamthesenate2,dxkwl5u,2018-04-18 18:03:26,18,0
Can't express how good this mode is! There's nothing about it I'd change.  Could we have a Prequel version of it? Geonosian vs Clones from TCW. Perhaps a Sequel version as well (for fairness). And most definitely make it permanent!,2,rogue6800,dxkwwci,2018-04-18 18:08:04,18,0
"I feel the cave really ruins the mode. Well not ruins, but it would be much better without a cave honestly. ",2,ProbablyFear,dxlaqwn,2018-04-18 21:32:42,21,0
"The mode is very fun! Wandering around as a stormtrooper has that sense of anticipation, that ""oh no did I just see an ewok running through that bush?""   I love how fun both sides are and that losing or winning can be fun. If you die as a stormtrooper, you become an ewok. If you win as an ewok, you get the bonus for winning.   ",2,Potatoslayer2,dxk9jpa,2018-04-18 11:45:51,11,0
"Excellent work guys, its super fun and keeps you on your edge. The only thing i would change right now is the cave. The imps just run and hide in their and all the ewoks just keep charging them till they've wiped em all out. ",2,kamikazee786,dxka6xk,2018-04-18 12:02:21,12,0
I m loving the game mode ,2,Ytallus,dxkabhu,2018-04-18 12:05:27,12,0
"Great change of pace, I love the whole concept. I do think though that it should be slightly tougher for the stormtroopers to board the actual shuttle, it’s quite easy if you’re in the close and in the area. Also when private matches are introduced to the game this should DEFINITELY be included, my friends and I would have an absolute blast playing this between each other.",2,ThinKappyThoughts,dxkael9,2018-04-18 12:07:33,12,0
How long will the game mode be around for?,2,DailYxDosE,dxkaqpx,2018-04-18 12:15:42,12,2
"Love the mode! The feeling of dread never disappears, and seeing those little shits running is scary. Only thing I hate is low damage that ewoks do. Sometimes hitting stormies 10 times doesn't kill them, and maybe add 1-2 more players to ewok team at start. Would love to see this become permanent mode, but only if you add other maps/hunt types (wampas vs rebels, clones vs zombie geonosian etc..) As long as you keep that ""horror"" feel.",2,GhostCR0,dxkb2m3,2018-04-18 12:23:21,12,0
"Ewok need to move faster and have more base damage. Don't let the Stormtroopers roll, and lock off entrance into the cave. Limit stormtrooper stamina so they can't sprint continuously ",2,Landocalrissan,dxkb770,2018-04-18 12:26:17,12,0
"I have to wait until I'm finished at work before trying the mode, but I've watched a video and it seems like I'm going to love it. Please keep this mode! :o I LOVE Caravan of Courage and am happy to see the wisties come back, and also listening to all the sounds on Endor. Can't wait to get home!! :D",2,Nimperedhil,dxkb7sn,2018-04-18 12:26:40,12,0
"A fantastic addition! Really fun and refreshing. Please make this a permanent mode! And expand on it in the future.  As for the people complaining about the cave, maybe make it darker or remove the torches? Think of how scary the cave would be in pitch black with only a flash light..  Good work, DICE!",2,J0hnn2049,dxkb9wo,2018-04-18 12:28:00,12,0
"It's very fun, and there is so much potential for hunt. I hope we get something where we can play as Ewoks in arcade though",2,OneEyedWells,dxkbi6o,2018-04-18 12:33:12,12,0
"I love this gamemode, especially with friends. Suggestions ___ give the last man standing more health - shorten the rounds to 3-4 minutes but have 3 rounds per game - put an icon on the last man standing - don't show the ewoks the ship is landing (I find myself running into 8+ ewoks at the ship making boarding near impossible at times). Love this mode and the potential for other factions/species to be added! ",2,DarkRebellion,dxkbwlw,2018-04-18 12:42:00,12,0
"Reposting since I haven't seen this thread yet:   * Hilarious! Love to see some other kind of 'battlefront'.   * More classes for ewoks and stormtrooper kits to pick from crates would be cool.   * The map needs some makeover, or the stormtroopers need some incentive to move around. Currently, players always gather in the cave. This basically causes the chokepoint mess from GA to appear in this gamemode. Endless ewok grenade throwing instead of preying in the dark.",2,Diff_sion,dxkbzhu,2018-04-18 12:43:44,12,0
So fun,2,darkveeder,dxke7ol,2018-04-18 13:27:32,13,0
"Man, I wish I had Gold so I could play. ",2,HostilesAhead_BF-05,dxkeugb,2018-04-18 13:38:48,13,0
An ewok only tunnel into the cave (unless there is already one I haven't found) ,2,RichardMunday,dxkfbu5,2018-04-18 13:47:05,13,1
Its so much fun,2,darkveeder,dxkfq4t,2018-04-18 13:53:44,13,0
"It's fun, it's kind of creepy and funny at the same time.  Nice touch that troopers can not use 3rd person view.   My only big problem is that I get stuck on every little f*cking thing on the map (which happens often on other maps too but here it is much more frustrating because it's dark and sometimes I can not even see what am I stuck on).   Smaller problems:   - ewoks can not overtake running troopers which is a problem since they don't have ranged weapons  - all troopers are just camping in the caves  - it takes 5-6 hits for an ewok to kill a trooper from behind - it's too many; the game should reward you if you can flank an enemy as an ewok ",2,iluvatartheone,dxkha8n,2018-04-18 14:19:27,14,1
Could we get an explanation of how the traps work?,2,TrevorBOB9,dxkk1tx,2018-04-18 15:01:58,15,0
"DICE has done a fantastic job with this new gamemode - I really hope Hunt is made as a permanent mode soon with variations that could include rebels vs wampas in a dark ice cave on hoth at night, droids vs gungans in the naboo forest at night, clones vs geonosian zombies, an 'order 66' style coruscant map with generic Jedi padawans vs clone troopers (this one could be tweaked a little to start off as 15 vs 5, 18 Jedi vs 2 clones would be too difficult for the clones I think!)",2,goesbyanyothername,dxkk6oa,2018-04-18 15:03:59,15,0
"Going to hop on the bandwagon and say this mode is great! Also agreeing this should be permanent AND should span all eras with different units (gungans, geonesians, porgs, etc).",2,AlohaBabez,dxklmj1,2018-04-18 15:25:13,15,0
"its very nice, the only thing that I didnt like so much is that walking around as an ewok is not very fluid. It needed some more care in the animation",2,mr_ako,dxklmvk,2018-04-18 15:25:22,15,0
"Exceptional work as always, would love to see Rebels on Tauntans vs Wampas in a blizzard and other gamemodes in this style as well as more unique ones. Maybe prop hunt with Jawas hunting mouse droids and/or gonk droids in and around a sandcrawler. Think the Jawa Refuge map from the last game but with an open sandcrawler door",2,Halbix,dxklq7s,2018-04-18 15:26:41,15,0
"Would love to see Ewoks brought over into other modes as a ""hunter"" or ""beast"" class. Enforcer doesn't really fit them but for Immersions sake, it would be cool",2,Halbix,dxklwx4,2018-04-18 15:29:23,15,0
Loving Ewok Hunt and the new skins--you guys are the bomb,2,Funkadelikk421,dxkmnjy,2018-04-18 15:40:08,15,0
"Fun gamemode, but the ""X has been lost to the forest"" message right in the middle of your HUD is really annoying and distracting and should be moved somewhere less intrusive.  Also the caves should be taken out, then real fear will be known. ",2,UnwantedRhetoric,dxknnzi,2018-04-18 15:54:42,15,0
"Love it! This mode is so much fun. I think the mode could be balanced just a tad more by adding one or two ewoks at the start of the game. I have now played several games where 10+ stormtroopers survive because the ewoks get off to a really poor start. Thank you!  Edit: Also, if the cave could be dark, that would be much better. Right now it's way too easy for stormtroopers to hole up and survive in there.",2,ikenslay117,dxkoo60,2018-04-18 16:09:14,16,0
Definitely needs to be more refined. Voice lines for it and what not.,2,badkneegrows,dxkqp4r,2018-04-18 16:38:24,16,0
"The mode is great, it should not be only temporary. In the future would be nice to get Tusken hunt and also Wampa hunt mode, to add some variety.",2,Soveyy,dxktige,2018-04-18 17:18:46,17,0
"Dont let something this cool be used as a cheap ploy to keep people coming back. MAKE IT PERMANENT!!!!!  Jawa Hunt on Tatooine,   Stormtroopers hiding in sandcrawler vs Jawas with shockblasters etc.  More interactions with traps  Randomly spawning hidden speeder bike that both ewoks and troopers can drive",2,theOriginalZach,dxkwak0,2018-04-18 17:59:03,17,0
"Overall- fun, immersive. Love destructive trees and sound/lighting is great.   I think storm troopers need a reason to move. 2-3 objectives to complete throughout the timer. This will prevent them from sitting in one spot the whole time, caves especially. Something dynamic like 80% of ur surviving team needs to be around atat. This prevents it from being 1 player PTO, these are team objectives. Don’t let Ewoks see what/where objectives are so they can’t camp them, they only hunt.  Also an objective could have 2 locations at once, so send x troops here and y here. So team has to split up. This should greatly increase the o shit moments that stormtroopers fee.   Too many weapon upgrades for stormtroopers. Or if u keep this many, make them expire after a minute or two. Or don’t give weapon upgrade flashlight and bomb. Give me some reason to use default, as is I first go find an upgrade every game because the upgrade is vastly better.   I think these 2 above are needed. These I don’t think are needed, but would add to the creepiness- lightning/thunder with rain falling night variant makes sound harder to pick up and more awesome lighting effects and mist/fog dust (dark, but less dark than now to adjust for fog).   ",2,DallasDonkies,dxkwk2b,2018-04-18 18:02:58,18,0
"It's so much fun. Please keep it as a full-time mode.   I typically don't care about emotes, but the ones for Ewoks and even the Stormtroopers are pretty epic in this one, LOL.",2,Nighthawkx29,dxky742,2018-04-18 18:27:07,18,0
"Ewok Hunt is cool, ewoks are scary.   Order 66 mode please.   Clone Wars Customization please.    That's all what I want.",2,CT7511,dxkztyz,2018-04-18 18:50:58,18,0
They could also make Tuscan raiders on Tatooine vs stormtroopers also I don’t think it’s to much of a stretch that when searching for the R2 and C3PO some could have been attacked by raiders.    Another idea is the the episode of the clone wars on the moon of Pantora when the Talz attacked the clone and droid bases could go either way. *  Also Geonosis also from the clone wars the Geonosians and clones inside of a cave network the Geonosians could be the brain invaders or regular living ones.  They could do wampas and rebels I’ve seen that post a few times   Hunt is a very promising mode with a lot of content potential. But the Talz are what I want most they’re abilities could even be very similar to Ewoks ,2,Aj_bary,dxl0zse,2018-04-18 19:08:02,19,0
"I’m sure I’m beating a dead horse but I want to say it anyway :)  1. Keep this game mode and all “temporary” game modes active, if possible. 2. Include Hunts on other planets the same as in BF2 from 2000s. 3. Consider letting people choose their side from the start, hunters vs hunted. Obviously this would change the whole objective so just an idea. 4. Keep Ewoks as enforcers for Rebel Endor missions. (I’m not sure they’re good enough/cool enough to replace all enforcers for rebels in other maps) 5. Please make next Hunt in the prequel timeline because the community is very clearly underwhelmed with the prequel content so far and that was supposed to be the entire draw of this game in my opinion, clone wars era. One example was droids vs wookies on kashyyk. Considering the models all exist already it seems doable.",2,BPbeats,dxl1eh2,2018-04-18 19:14:00,19,0
"I was having a hard time finding party members I joined with. I know it makes it cinematic to be alone in dark but I only have one friend I would like to stick with, seems fair?  He would have green outline at some times and not at others? Wasn’t sure of the parameters.",2,BPbeats,dxl1ifa,2018-04-18 19:15:37,19,0
"- I love how you can see footprints with Hunters Instincts active  - The horns are great as a signal for the Ewoks.  hearing them call out and answer each other ""He's here!""  ""We're coming"" is scary as hell  - forced 1st person is also a great touch.  springting through the dark makes every bush look like a jumpscare  - THEIR EYES GLOW WHEN YOU SHINE A FLASHLIGHT AT THEM HOLY SHIT",2,Dai_Kaisho,dxl1o2i,2018-04-18 19:17:50,19,0
I was clumsy and killed myself with a grenade. It wouldn't let me spawn again and I was stuck looking at the ground where I died.,2,TryAgainIn8Minutes,dxl250h,2018-04-18 19:24:42,19,0
The only good thing in the update,2,Orion920,dxl2bhi,2018-04-18 19:27:18,19,0
"I can only say that, if you don’t change the layout and the cave setting, make the starting Ewoks more or something. It’s too easy to just hole up. Mode is super fun though. I’d consider just making it interchangeable to whatever plant creatures exist. ",2,DeftonesRonC,dxl2c66,2018-04-18 19:27:35,19,0
Permanent,2,DVineInc,dxl2ndv,2018-04-18 19:32:11,19,0
man I like this event so much I laugh so much when we as ewoks shout like savages and chase a lone stromtrooper  only downside is that cave. but after _you take them out_ _ONE_ by _ONE_ few remain and then you sound the horns and all ewoks charge in and eat the stormtroopers,2,stark33per,dxl2qem,2018-04-18 19:33:23,19,0
"""If I had asked my customers what they wanted they would have said a faster horse."" - Henry Ford (apocryphal)  Thank you for making Ewok Hunt, a creative new mode that almost nobody on this sub wanted, until they had a chance to play it or see it in action.",2,AstralDragon1979,dxl37tq,2018-04-18 19:40:25,19,0
"This is such a fun mode, i love that is kinda like a zombie infection, the tense feeling of spotting an ewok and its bright eyes is priceless, the level design is great, i enjoy finding traps or destroyed at-st on the dark, please make it permanent and later add wampas vs. rebels, imperials or rebels vs. tusken raiders, etc. the posibilities are endless.",2,clendo44,dxl3bca,2018-04-18 19:41:49,19,0
Mod is so good. Next one should be with jedi vs clones :),2,HorusTheFalcon,dxl47rz,2018-04-18 19:54:49,19,0
"This mode was really fun. It actually made me scream a bit while playing as a Stormtrooper. F8RGE, I insist that this mode becomes permanent. I believe the mode could be expanded upon by adding Jedi vs Clones, Wampas vs Rebels, or Geonosians vs Clones.  Love the mode. Keep up the good work! :)  P.S. ""[insert name here] was lost to the forest"" is bloody terrifying.",2,Tiger-Bear991,dxl4sfb,2018-04-18 20:03:16,20,0
"This mode is a home run. So much more fun then I thought it was going to be, super tense, a lil spooky. This mode feels so completely different in style and tone then the rest of the game modes, to me it is a keeper.   Had so much fun playing last night when the update dropped, I totally lost track of time. The visibility mechanic is well done, and the gameplay just felt fantastic. If this becomes a normal game mode, I would be ecstatic. ",2,Narwhal_Rider,dxl4sxd,2018-04-18 20:03:29,20,0
"I really enjoy the mode, but I think there needs to be a way to let us play in Third Person as Stormtroopers. It's a bit disorienting playing exclusively in Third Person only to be forced into First in this one game mode. Even if the view is a limited one, I would perform much better than being stuck in First Person.",2,JongoFett12,dxl4t32,2018-04-18 20:03:33,20,0
"I see so few people talking about the first person only and the flashlight. I think it makes it so much better, as the ewoks end up becoming quite scary!",2,carbonatedfuck,dxl4wb3,2018-04-18 20:04:54,20,0
"Traps should not be automatically set, Ewoks should have to arm them in the same way stormtroopers have to get weapon from crates",2,zebie31,dxl5p8h,2018-04-18 20:16:39,20,0
"This ""Hunt"" mode could become something totally original. Imagine it like this, between seasons, the Hunt mode get's expanded further and further. For example: Night on Endor (Ewok v Stormtroopers) - Season 2 - Black market (Jawas v Stormtroopers) - Season 3 - Hunting for Carpets ( Bossk v weak Wookies ) --- etc.",2,kyle-ron,dxl678m,2018-04-18 20:23:54,20,0
The map feels too large it should be smaller too increase encounters at the start of the match,2,WEDGES_YULE_LOG,dxl72qu,2018-04-18 20:36:41,20,0
"Xbox squads still hard lock the game, thanks!",2,Harkonis,dxl759z,2018-04-18 20:37:43,20,1
