"I'm confused...    Part of the reason I was sort of excited for the Ewok Hunt announcement was because I thought it was the beginning of DICE adding unique new content to the game **that was going to stay permanent, and thus would remain a part of the package**...    Why is removal of game modes even a thing?  There should only be addition to this game, no subtraction, if they want it to flourish in the coming months.",3,Moops7,dxm3d3l,2018-04-19 06:27:05,06,3
Make Hunt permanent and expand on it. Not just Ewok hunt,3,VeiMuri,dxm5to6,2018-04-19 07:54:01,07,0
Oh a piece of candy!,3,allamerican37,dxm1pct,2018-04-19 05:37:25,05,0
I liked it so much it inspired me to write a short story about it. [Here](https://www.reddit.com/r/StarWarsBattlefront/comments/8dbd1r/a_night_on_endor_short_story_inspired_by_ewok_hunt/?st=JG67MX6K&sh=d7d7e14e) is the link if you're interested in reading it.,3,Rob5244,dxm5ci8,2018-04-19 07:35:44,07,1
"It's a real gem.  Honestly I'd pay for a standalone, but I'm glad it gets the boost of being available to all BF2 players.",3,Dai_Kaisho,dxm4xy6,2018-04-19 07:20:43,07,0
I want ewok jetpack cargo!,3,IG-88_,dxm9820,2018-04-19 10:12:34,10,0
Do you think gamers back in 1999 ever thought they would have to worry about content *leaving* their games?,3,Nivrap,dxmanft,2018-04-19 11:03:18,11,0
"I stopped playing a few months ago - not out of hatred. I was really enjoying the game, but I kind of didn’t find enthusiasm to put it back on. However I’ve heard of all the new changes and this mode - would it be worth coming on just to play it? Looks really fun! ",3,ViceroyGunrayTheLad,dxm53xc,2018-04-19 07:26:49,07,1
"I like it enough for it to stay, its a nice break from the repetitiveness of the other modes/maps",3,nfis,dxm59ez,2018-04-19 07:32:31,07,0
I would love it! I hope they flesh it out with more Hunt modes too! Put them all into a playlist and voila!,3,SymbioticCarnage,dxm703f,2018-04-19 08:40:04,08,0
Permanent permanent permanent! ,3,j_cxa,dxm9eqv,2018-04-19 10:19:55,10,0
"If they make other hunt modes, I want them to keep the horror feel of Ewok Hunt. If it's Wampas on Hoth, I want there to be tons of hidden tunnels and ambush points for Wampas and I want it to be pitch black with minimal lighting.",3,namapo,dxmazcl,2018-04-19 11:13:53,11,0
Yes please! This is one of those game modes where win or lose it's  just so much fun. I had a blast playing it and I love playing as the ewoks.,3,DTlll,dxm6jta,2018-04-19 08:22:12,08,0
"Yes, this needs to stay! Brilliant gamemode :)",3,Nimperedhil,dxm6vpp,2018-04-19 08:35:16,08,0
Jetpack Hunt I total darkness,3,neandersthall,dxm7tjr,2018-04-19 09:14:24,09,0
Permenant status... and add to it.   And add 4 ewoks to Research 9 Endor with max rank out of 20.  K thanks.,3,Hyperfire1138-PSN,dxm7vhd,2018-04-19 09:16:41,09,0
"Good thing about this is, hopefully down the line they can make different variations of hunt mode, Gungan hunt, Wampa hunt, Rathtar Hunt. There’s so much potential to be found here, lets just hope we see more of this! ",3,Darknight307,dxm8al3,2018-04-19 09:34:38,09,1
# #PermanentEwokHunt,3,Tiger-Bear991,dxm9kl0,2018-04-19 10:25:46,10,0
"Since they spent the time and resources to make Ewok Hunt, I think it should be permanent. ",3,CDaKidd,dxmavy1,2018-04-19 11:10:53,11,0
"My PS plus is down but I'll vote to male it permanat since I want to play when I get my PS plus back. This game needs more modes anyway especially for ARCADE(hint,hint, nudge,nudge)",3,cityguy244,dxmb15s,2018-04-19 11:15:25,11,0
"All we need now are tuskan raiders,jawas and the snow creatures. ",3,Maddison_Mavis,dxmbkrb,2018-04-19 11:31:25,11,0
"Honestly let's admit it, this game mode is awesome. But they shouldn't just handicap it to ewok hunt. They have proven they can make a great Hunt game mode in general! Let's get Tusken raiders, wampas, and any other ones anyone can think of!",3,ericN322,dxmbttp,2018-04-19 11:38:27,11,0
Yub nub!!!,3,JakeTanker,dxmgbq4,2018-04-19 13:20:22,13,0
I think it needs some work but I enjoyed playing so far.,3,Dark-Porkins,dxmipgx,2018-04-19 14:03:00,14,0
"I'd prefer them to cycle modes, no one actually wants this single mode to be permanent, you all decided this after playing a few hours on the first day? Must all be very impulsive.",3,ElectricSheep1988,dxmjucj,2018-04-19 14:21:47,14,0
They should have a Genonosis Hunt map mode where a squad of clones have to make it through the dark caves of Geonosis while trying to survive attacks from the Geonosians popping out of their caves. ,3,mkgsmk97,dxmjvwd,2018-04-19 14:22:28,14,0
"Why the fuck would they add something like this to the game, then just take it away?  Leave this shit in to give people options.",3,Insaniaksin,dxmjykf,2018-04-19 14:23:42,14,0
Yes please add this game mode permanently and more like it.  I found it very fun.,3,Dark_Myth,dxmko4x,2018-04-19 14:35:12,14,0
All I want is a server browser...,3,roguesqdn3,dxmsrz5,2018-04-19 16:36:57,16,1
Needs a lot of improvement to be permanent.  Bored after winning my first 4 games way too easy as a stormtrooper.,3,BFFulcrum,dxm5nej,2018-04-19 07:47:21,07,1
"In its current state, It’ll be dead in a week or so, not worth waisting server resources on permanently.   Just bring it back every so often so people have a few days of fun and work on something more substantial and lasting.",3,Lando_uk,dxm8tto,2018-04-19 09:56:39,09,2
You read my mind! Not sure if I️ should post about it myself or just upvote this,3,PiNinja99,dxm62tk,2018-04-19 08:03:57,08,0
Definitely make it permanent.,3,tarasis,dxm662w,2018-04-19 08:07:29,08,0
"Seriously though, what is the point of it being limited time anyways.",3,alvinchimp,dxm708e,2018-04-19 08:40:16,08,0
"Take my money, the mode is awesome ",3,Bhalzard,dxm9031,2018-04-19 10:03:45,10,0
/signed,3,ShadowDr0ne,dxma4c5,2018-04-19 10:45:27,10,0
"If they keep timed challenges rotating for all modes, thst way there will be players in games of other modes ect. I find myself playing just for achievements, and daily challenges. ",3,bjswifty,dxma8yg,2018-04-19 10:49:51,10,0
"This mode is very, very fun. That is all.",3,psilosybical,dxmau8f,2018-04-19 11:09:21,11,0
They should definitely have hunt be permanent and add to it with the other hunts from the classic BF2,3,JLit214,dxmbuvb,2018-04-19 11:39:13,11,0
If they make it perm they should make the ewok xp count towards enforcer level so that we can get some xp by playing,3,MajinChopsticks,dxmc8b1,2018-04-19 11:49:18,11,0
"Yes! Along with this being super fun, keeping it can also give us new maps and enemies for it!",3,jetstreamer123,dxmcetz,2018-04-19 11:54:00,11,0
I love this mode! It's the new spies vs mercs! Keep it permanent!,3,stonehands1876,dxmcjtg,2018-04-19 11:57:34,11,0
It's a great! Only played a few rounds so far but God dam!,3,hksmick,dxmcpwm,2018-04-19 12:01:57,12,0
See you boys on the o.g. star wars battlefront in just a few days time. None of this modern-day shit-on-a-stick,3,A-whole-by-choice,dxmcpyh,2018-04-19 12:01:59,12,0
Absolutely love this game mode. I think the Ewoks need a few more abilities or more weapon options but this game really gets the adrenaline flowing!,3,grantw50,dxmcsdu,2018-04-19 12:03:41,12,0
Make it permanent and expand it in the Future to a complete Hunt Mode with more maps and species! ,3,slagerthauhd,dxmd3wl,2018-04-19 12:11:34,12,0
YUB NUB!!,3,KandyBarz,dxmd73g,2018-04-19 12:13:44,12,0
We need Wampa Hunt in a blizzard!,3,lja_,dxmddb6,2018-04-19 12:17:56,12,0
Make ewok hunt Permanent,3,darththeIII,dxmdjim,2018-04-19 12:21:59,12,0
"Only if they add a few more maps or make a whole 'hunt mode' with different aliens on different planets.  Jawas, wookiees, wampas, gungans, etc.  I feel like I pretty much learned the map in Ewok Hunt just a few matches in, and then every game played out the same way after that.  As fun as it is, it's just not sustainable as a permanent mode unless they put some more work into it.",3,Horse625,dxmdlhf,2018-04-19 12:23:17,12,0
"Are we blind? Deploy the Ewok Hunt posts, move!",3,Generic_Nerd_Dude,dxmdlou,2018-04-19 12:23:24,12,0
"I would totally love a multiplayer 'arcade' mode with jetpack cargo, ewok hunt, etc. ",3,RSpudieD,dxmdmnl,2018-04-19 12:24:02,12,0
as if they wont eventually just make it a permanent part of the game,3,Portatort,dxmduac,2018-04-19 12:28:55,12,0
It’s way too much fun to be only limited time. But there should also be other variations. One I’d like to see is clones vs geonosians in the geonosian catacombs like in this Republic Commando teaser trailer: https://www.youtube.com/watch?v=lB44F5VQcqE,3,Leon0628,dxmdy71,2018-04-19 12:31:21,12,0
"I support this too, I think Battlefront 2 would benefit from a permanent ""horror"" style mode.",3,Grand_Admrial_Thrawn,dxmdyif,2018-04-19 12:31:33,12,0
"I loved playing Ewok hunt.  My only ""issue"" is that while playing this mode I am not progressing my unit levels or my milestone progression.  And I feel like I still have a lot of ""work"" to do on that front.",3,DKG1974,dxmdyjx,2018-04-19 12:31:34,12,0
I love it so much,3,xpigmarr,dxme79u,2018-04-19 12:36:58,12,0
Please! It's so enjoyable and creative!,3,StrickenCross88,dxmf38f,2018-04-19 12:55:54,12,0
"I like other posts referring to potential new options (tusken raiders, wamps, etc.); however, I think the Ewok's damage should be boosted.  When the stormtroopers get into the cave, it almost becomes incredibly easy.  I was in a match yesterday, and there was like 1 poor guy that started as an Ewok but couldn't get any kills. He might've gotten one or two toward the verrry end of the match, but it was largely just us camping in the cave...",3,AiringHouse,dxmg04k,2018-04-19 13:14:16,13,1
WE LIKE,3,MajikkijaM,dxmgp7q,2018-04-19 13:27:21,13,0
No. ,3,Ryndmere,dxmgy6l,2018-04-19 13:31:58,13,0
Add in Gungans on Naboo against B1's in the night then my entire life's purpose will be fulfilled.,3,KolbyMax,dxmhmv7,2018-04-19 13:44:21,13,0
MORE HUNT MODES ,3,Clone12319,dxmhnjp,2018-04-19 13:44:41,13,0
"I hope they add more maps, the mode is too much fun!",3,InternetPerson9000,dxmhnz0,2018-04-19 13:44:54,13,0
"As someone that was initially skeptical of Ewok Hunt, I found myself enjoying the hell out of it. I have to say this is a good type of ""filler"" content between seasons.",3,J4ckiebrown,dxmhqh4,2018-04-19 13:46:08,13,0
This game mode was so refreshing I had an absolute blast with it. Please keep it!!!,3,damstr,dxmi06s,2018-04-19 13:50:52,13,0
"Do people know that the more game modes that stay, the smaller the player pools get for each mode?",3,NovaCore__,dxmi2lr,2018-04-19 13:52:04,13,0
"Personally, I am the super casual player that this mode is aimed at, and I found it to be exceptionally boring after 4 rounds.  I would probably play it more if they blocked off the cave, and reduced the amount of nightvision that Ewoks have.",3,ghost_soul167,dxmi7z1,2018-04-19 13:54:39,13,0
"Haven't played in a while, what's ewok hunt? Sounds pretty fun. ",3,Tsalagi_,dxmidv9,2018-04-19 13:57:29,13,0
So my question is. If this is season 2 dlc why wouldn’t it be permanent? Seen stupid to take it out no matter what. ,3,schreck5,dxmirx2,2018-04-19 14:04:09,14,0
"Here’s an idea. Make like five or six of these types of games similar to Ewok hunt, jet pack cargo, CTF and place them all in a rotating mini game cycle. ",3,whiskeyclouds,dxmj4sq,2018-04-19 14:10:08,14,0
I don’t even have BFII(II) but this mode sounds awesome!,3,Jombo65,dxmjfz2,2018-04-19 14:15:17,14,0
"I might get downvoted for this opinion, but hear me out:  In some games, reoccuring or ""on again/off again"" events actually work to do many things such as prevent staleness, create anticipation, and basically add variety.   I play a few other games that have special events that last for a week to 10 days or so then get turned off. There's about 6 of these special event modes. Every month there's two events.   Imagine Ewok hunt always being available. Eventually, it would get stale and the mode would be more or less abandoned. Now imagine that eventually we have an Ewok Hunt, Wampa Hunt, Rancor survival, and several other specialty modes that run for a week or two then turn off then in another week or two we get a fresh mode again. this rotation would always have something new and refreshing for us to try.   I hope the devs consider this option. I'd hate for Ewok Hunt to get boring after awhile and then abandoned when it's really a cool mode..   Edit: In addition to this, DICE might want to explore adding a mini battle royale mode to Battlefront. It would make for a pretty cool event. ",3,Beulshite,dxmjmcz,2018-04-19 14:18:12,14,0
"If they ever add private matches, this would be a perfect game type to play with just friends. Ewok Hunt is hilarious and spooky. Love it. ",3,ReconsLegacy,dxmjr9l,2018-04-19 14:20:25,14,0
"Its definitely a cool mode, but they should expand on it and include different creatures and factions. ",3,I_Phaze_I,dxmk1vd,2018-04-19 14:25:11,14,0
#MakeBattlefrontGreatAgain,3,JediRenegade93,dxmksyg,2018-04-19 14:37:25,14,0
Loved Ewok hunt - tons better than Jetpack Cargo. Would love to see it stay. Those damn horns as a Stormtrooper while you're out and exposed creeped me out too,3,ValyrianSteelYoGirl,dxmleq8,2018-04-19 14:46:58,14,0
Just tell me what I need to do,3,Lord-Maplefrost,dxmljgw,2018-04-19 14:49:03,14,0
Please keep it ,3,Big_T_7575,dxmltfs,2018-04-19 14:53:25,14,0
This battle royale thing is getting a bit much for me.,3,Vigilias,dxmltzn,2018-04-19 14:53:39,14,0
"So are the Ewoks doing the hunting or being hunted? Because I’d love to kill Ewoks all day. Hunting as an Ewok, though, is pretty lame. ",3,Seems-Reasonable,dxmlz9u,2018-04-19 14:56:00,14,0
I haven't played this game since December. I think it's time to come back.,3,DakThatAssUp,dxmm52z,2018-04-19 14:58:28,14,0
Please make it permanent!,3,TarturasVII,dxmmfih,2018-04-19 15:02:58,15,0
In here to show my support. ,3,SillyNonsense,dxmna8l,2018-04-19 15:16:16,15,0
Getting this to the top 20 posts of all time will definitely make him consider it. ,3,Weenie_Wok,dxmnzwt,2018-04-19 15:26:52,15,0
Id like to play as certain creatures on GA.  Certain creatures for certain maps,3,bhc1985,dxmo2qm,2018-04-19 15:28:01,15,0
Having a hunt mode on Tatooine with a Sarlacc as an environmental trap would be fun. ,3,DisguisedAsHuman,dxmo5ez,2018-04-19 15:29:07,15,0
Hey weren’t we supposed to not buy this game or something?,3,Brotimus,dxmo8fv,2018-04-19 15:30:21,15,1
Where can i find the ewok hunt? [ps4 user],3,Taguroizumo,dxmoco1,2018-04-19 15:32:07,15,0
"Id imagine that a wampa hunt mode would be something lighter than the Saxton Hale mode in TF2, or a lighter version of evolve, something where you slowly take out survivors one by one. Maybe something similar to how a Xenomorph works. And you would have to deal with this wampa encounter through a series of caves. It might be cheap to recycle the Arena hoth map from Battlefront ( 2015 )",3,EnemyAdensmith,dxmp40h,2018-04-19 15:43:25,15,0
Please make this available to the arcade as well. I’m loving terrorizing stormtroopers as Ewoks. ,3,Rafficus-III,dxmp6dz,2018-04-19 15:44:22,15,0
"Please god make it a permanent gamemode. This is hilariously fun, and addicting to play as a trooper trying to survive, or blowing that horn and freaking out every stormtrooper in the vicinity ",3,BcElliott72,dxmp6xn,2018-04-19 15:44:35,15,0
"Yes! make Ewok hunt permanent. Also, add Ewoks to all Endor Maps as a reinforcement and add this map to the other game modes! I want GA with this map since it appears to me that it's Survivors of Endor.",3,MadFlava76,dxmpf8u,2018-04-19 15:48:02,15,0
"I haven't tried it yet, but it seems super fun. They've obviously out a lot of work into it so why take it away? ",3,HeadClanker,dxmq148,2018-04-19 15:56:59,15,0
"MAKE EWOK HUNT MODE PERMANENT PLEASE!!!  But consider adding...  Ewok sized Wookies  Wookie sized Ewoks (you can't spell 'WoOKiE' without 'EWOK'),   Ewoks in combat gliders,  Log traps,  Netting that pulled you up into a tree that immobilises you for a short time, making you vunerable to attack,  To be able to disable/spring traps by shooting them,  Bungee-ewok attacks (my own invention, using my old Ewok figures, KENNER treehouse toy and elastic bands)  Ewoks on speeder bikes,  Princess Kneesaa (from 80's Ewoks cartoon),  Stormtroopers captured, tied to bbq's with their health slowly going down until freed by another player,   The Gorax (from 80's Ewok live-action movie),   Plant traps laid by the Leaf Queen (from 80's Ewoks cartoon),  Underground tunnels the ewoks can run through with hatches that ewoks can open to drop troopers in harms way,   Covered pits with spears at the bottom,   A cameo by the big rolling rock from 'Raiders of the lost ark' with sound effects supplied by Star Wars sound designer Ben Burtt using a microphone and an earthworm burrowing, (Hey, you younglings learned something today ;)  HOOJIBS (80's Marvel comics SW characters who have travelled to Endor),  Ewok activated rockslides, etc.  If the above is too much, I will be happy with...  MAKE EWOK HUNT MODE PERMANENT PLEASE!!! ",3,wise_beyond_my_ears,dxmq5nw,2018-04-19 15:58:48,15,0
"You can have my vote - even though I was easily bored after a few rounds myself, but if everyone else wants it let's keep it!",3,NoctD,dxmqaws,2018-04-19 16:00:54,16,0
"How many upvotes do you think will be ""Enough""???? ",3,fizznick,dxmqm8c,2018-04-19 16:05:31,16,0
MAKE IT PERMANENT!,3,TheMoose65,dxmrhnp,2018-04-19 16:18:23,16,0
Loving the hunt mode. It’s way harder and causes me not to play kamikaze style,3,ifallalot,dxmrqy1,2018-04-19 16:22:07,16,0
Let's have it to stay.,3,optimisedEnergy,dxms5z0,2018-04-19 16:28:06,16,0
"I am genuinely surprised at how amazing this mode is. It was so well made and it seems a lot more effort was put into it that I initially expected when it was first announced. I played it with a few friends and we had a blast, we were cracking up the whole time.  It's insanely fun no matter which side you're on, I'd love for it to stay.",3,ZoidVII,dxmsghc,2018-04-19 16:32:18,16,0
"Keep Ewok Hunt and give some different maps. Or switch up the themes and have a general ""Hunt"" mode with different factions on different maps.  PS: And PLEASE do something about the caves. Caves are fine, but to have a vast network of underground caves that Troopers can camp out in until the dropship arrives kind of ruins the mode. Give them a reason to need to leave the cave or have much smaller caves that can only house a few Troopers and make them very easy targets to the Ewoks.",3,CulDeSax,dxmsiic,2018-04-19 16:33:08,16,0
"DICE, please DON'T just gives us a bunch of smaller game modes with limited appeal, give us the big conquest-like game mode you have teased and new maps and new heroes... with all the hype I can see you spending all your develop time on these little game modes, but first give us the big content you have teased us with for months and months...",3,Gamera1967,dxmsovj,2018-04-19 16:35:43,16,0
Lol seems like the game is going in a great direction. So glad I didn’t buy this teaming pile of garbage ,3,Brendancs0,dxmth6f,2018-04-19 16:47:04,16,0
"Yo ewok hunt is straight fire ,  it feels so realistic with a 4k tv. The suspense of those little shits coming out of the dark has me going ",3,spoderman63,dxmtxgh,2018-04-19 16:53:37,16,0
Wait...they added hunt mode? That was one of my favorite things from the original and I never thought it would make it into this one.  How's the PC playerbase? I really want to buy this now but don't want another Battlefront/Titanfall2 situation where I buy a game only to find out the multiplayer is practically dead.,3,theavengingewok,dxm5p47,2018-04-19 07:49:10,07,1
They need to just add new game modes period. And something that isn’t lame like the jet pack mode. Ewok Hunt is a great start in a new direction. Still pissed about the skins though.,3,MlCKJAGGER,dxm6ie3,2018-04-19 08:20:37,08,0
Although I don’t enjoy this mode personally I don’t like the concept of “limited time modes” at all. It should stay if the community want it. ,3,ecxetra,dxm6tlu,2018-04-19 08:32:53,08,0
"No, it shouldn’t stay. It’s one map and one mode. If it stayed it would get stale and no one would play it after a couple weeks. Making it LTM means when it’s out people would actually play it. Atleast add more maps if you’re going to make it permanent because you’ll end up splitting the player base and everything will go wrong",3,jmario99,dxm877l,2018-04-19 09:30:34,09,1
its fun but i dont think it will still be in a few weeks so....,3,RnK_Clan,dxma5wd,2018-04-19 10:46:58,10,0
Need a smaller map or better spawn points or the shuttle needs to arrive sooner. I spend most of the game just running around in the dark lost. Very few skirmishes. It needs a lot of work because I find it very boring the way it is now.,3,Gurthee,dxm64kw,2018-04-19 08:05:53,08,0
"Eh, I played it for a bit and I'm kind of over it already.   I'd rather the incorporate the ewoks into GA or with some purpose other than ""just walk around and stay alive.""  Night cargo where the troopers or ewoks are trying to deliver something would be better.  Also things like nets, logs, or pits would be awesome.  Imagine GA with ewoks dropping nets from above and then troopers coming along and killing them or swinging a log down to knock out a row of troopers.  There is literally no purpose to the game as is and I don't see myself playing it again unless it were with a group of friends in the same room.  I do like the total darkness with flashlights. ",3,neandersthall,dxm7orm,2018-04-19 09:08:47,09,0
I totally agree this mode should stay. But they should probably change its name to hunted or something similar so they can also add Wampa hunt on Hoth and other hunts like with the Felucian Acklay on Felucia. Then make the maps rotate and stuff and you'll have a fun gamemode.,3,bengel2004,dxm8mlk,2018-04-19 09:48:29,09,0
I don't want this mode to stay unless they block off the camping cave. It ruins the whole mode. ,3,Noxdus,dxmbtiz,2018-04-19 11:38:13,11,0
I don’t really like this game mode it’s almost impossible for the Ewoks you just camp in the caves and your team wins,3,TheBubbyKing,dxmbdl1,2018-04-19 11:25:41,11,1
/r/titlegore,3,youreviltwinbrother,dxmcdi8,2018-04-19 11:53:01,11,0
How about trying out conquest mode....As cool as Ewok mode is. Why do we give them praise when this is not what the players want..,3,winjims,dxmdwqc,2018-04-19 12:30:26,12,0
how much do I have to pay to play it tho,3,ChieffBanana,dxm71rp,2018-04-19 08:42:01,08,1
FOR THE HONOR OF OUR BROTHERS!!!,4,sarnquee,dxmcy1v,2018-04-19 12:07:34,12,3
Geniunley one of the saddest moments of the original trilogy.,4,Stalemate9,dxmcz4v,2018-04-19 12:08:19,12,1
"Watched RotJ in 2008 when I was 8 years old.  Thought is was one of the saddest scenes (apart from Vader saying ""you already have""  to Luke) ",4,Wolffe2100,dxmg8dp,2018-04-19 13:18:39,13,1
YUB NUB! ,4,j_cxa,dxmf6cc,2018-04-19 12:57:42,12,0
Tell a sad story in just 23 seconds.,4,alexaka1,dxmj6io,2018-04-19 14:10:55,14,0
"Press ""Y"" to pay yub nubs",4,Qussan,dxmk5sz,2018-04-19 14:26:59,14,1
I never understood the hate for the Ewoks  Fucking adorable murder bears ,4,Nintengogo,dxmk29c,2018-04-19 14:25:22,14,2
Yub.....nub....,4,Mathranas,dxmj143,2018-04-19 14:08:29,14,0
That’s such a sad scene. Almost tear up every time I watch it. ,4,L-Guy_21,dxmi7wy,2018-04-19 13:54:38,13,0
To stop those terrorist r/empiredidnothingwrong,4,fhesmiterm,dxmdzln,2018-04-19 12:32:13,12,1
kill them all!!!! FOR THE EMPIRE,4,uninvincible314,dxmpgah,2018-04-19 15:48:28,15,0
That scream gets me everytime.  RIP brave ewok,4,blasterriflin,dxmmzxd,2018-04-19 15:11:49,15,0
"This was the saddest scene in the OT when I watched it as a kid, hell it still is :(",4,--Ace-,dxmn030,2018-04-19 15:11:54,15,0
Lol it looks like I’m in the minority here but as a kid (and now) I always rooted for the empire so I was cheering those at-st’s on pretty hard Edit: people really don’t like opinions around here...,4,brundlehails,dxmjt9b,2018-04-19 14:21:18,14,2
Leave a like if you cried,4,rustedpopcorn,dxmq52l,2018-04-19 15:58:34,15,0
F,4,NovaIsLegend,dxmq58n,2018-04-19 15:58:38,15,0
Why are we still here? Just to suffer...?!,4,thunderboyac,dxmqgok,2018-04-19 16:03:15,16,0
DO NOT SYMPATHIES WITH THE ENEMY! THEY HAVE MURDERED MANY OF ARE GREAT IMPERIAL FORCES! GLORY TO THE EMPIRE!,4,Ivan_Ivanov1,dxmqw26,2018-04-19 16:09:34,16,0
Jesus as a kid this broke my heart ,4,Axelfolly,dxmry9m,2018-04-19 16:25:03,16,0
""" NO NO YOU MUST DIE""",5,TheScandasian,dxmcqdh,2018-04-19 12:02:16,12,1
Holy shit... Wish Palpy had an electric choke hold throw.,5,DarthSwanson,dxmdzsd,2018-04-19 12:32:19,12,5
Unlimited... POWAAAA,5,Peaveyy,dxmcykp,2018-04-19 12:07:54,12,1
Fucking hell. That's carnage.,5,DualisticSilver,dxmfffi,2018-04-19 13:02:52,13,0
My God he got rocked,5,tinylegumes,dxmjiw4,2018-04-19 14:16:37,14,0
*evil smirk*  #POWAH!!!!  ,5,YodaHatesSeagulls,dxmknby,2018-04-19 14:34:51,14,0
What because he's black,5,superzuzu72,dxmitgr,2018-04-19 14:04:53,14,0
If that’s true thanks for the correction ,5,TheScandasian,dxml0k4,2018-04-19 14:40:42,14,0
It’s 2018 and you’re recording with your phone you donkey,5,7VERSACE,dxmijts,2018-04-19 14:00:19,14,0
You choose Darth Vader and play as Maul....oke xD,5,CapAustria,dxmmmsl,2018-04-19 15:06:08,15,0
That was fucking hilarious.,5,Kriega1,dxmmowu,2018-04-19 15:07:04,15,0
"This is Finn, not Mace...",5,dongandon,dxmnuuo,2018-04-19 15:24:48,15,0
This Luke empty. ***YEEEEET***,5,102IsMyNumber,dxmou0s,2018-04-19 15:39:19,15,0
"Bro, it's called the share button, right next to touch pad. ",5,madmike956,dxmovuc,2018-04-19 15:40:02,15,0
