"F8RGE, Ben... make it permanent. Obviously were all hyped for it now but it's a party game. COD made Prop Hunt full time so anytime me and my friends want to pull out bf2 and play this, we can.  Next, if you make it permanent, add like Clones hunting Jedi or Tuskens hunting Jawas etc. Add to the mode to make it not just a niche ewoks and stormtroopers. Even though that is really fun. Love Survivors of Endor btw.  Finally, put private lobbies in the game. Some of the most fun I had so far was surviving with just my friends and me alive. It was tense. Also, killing my friends was really fun. That alone should be enough of a reason to put private lobbies in. Other reasons? Competitive matches and just playing AGAINST friends in general.   Hopefully you read this, thanks for taking the time to read it. Keep up the good work, Ben.",2,Wicked_Bvllet-,dxkagvv,2018-04-18 12:09:07,12,21
"Just a little detail, but I'd like to hear the troopers in my team scream via comlink when they die",2,True_Prime,dxklvl5,2018-04-18 15:28:51,15,4
an order 66 game mode where few jedis try to survive against the clones.  a man can dream.,2,RnK_Clan,dxkanbl,2018-04-18 12:13:28,12,8
"Lots of great feedback in here, keep it coming all! We're reading, digesting it all.",2,F8RGE,dxkxely,2018-04-18 18:15:32,18,2
"The game could use a ""Party games"" playlist where slightly whacky gamemodes like this and a Jetpack cargo with added timer are rotating between rounds.",2,Taki17,dxk9a3d,2018-04-18 11:38:36,11,7
"The cave itself should only have limited light for a certain period. Makes it far spookier and makes the cave a no so safe haven. Definitely adding more to it like maybe ewok classes that can throw speaks or rocks.  If this becomes a permanent gamemode I'd like to see more hunt variations. Like Wampa,Gungan,Jawa and Genosian.",2,RG4ORDR,dxk9hne,2018-04-18 11:44:19,11,6
It's super fun but I would like to see  how many ewoks were killed on the end screen and who survived the longest,2,MDFKmusic,dxkacxq,2018-04-18 12:06:26,12,3
"I haven't played in a while, but I came back to play this. I wish there was more variety, as only one map over and over may get stale very quickly.    Hunt was my 2nd favorite gamemode in the original Battlefront II, behind Conquest of course... You know what? I think this actually superior to the original Hunt mode. The original Hunt was basically team deathmatch that kind of got repetitive after a while. This Hunt however, is more of an infection type gamemode, with added depth and I prefer it that way, and it keeps you on your toes when you're on the defending team.   I would have never expected to be afraid of goddamn EWOKS, (The sound design is absolutely incredible) but you succeeded in that, and I think this deserves to be a permanent gamemode.    I only played a few hours so far, but I never experienced Stormtroopers camping the caves yet. Hopefully that doesn't happen too often.",2,VvertigoV,dxkatgk,2018-04-18 12:17:31,12,1
"Bring in Hunt as a new gamemode and basically have it be the same on each map but with Wampas, Geonosians etc.   This gamemode is perfect.",2,LordNoddy,dxkao08,2018-04-18 12:13:57,12,0
"So bloody fun. Always seem to be thinking with my stomach as a stormtrooper though..  If this is a hint for Order 66, Gungans v Droids, Geonosians and other modes, then things are looking way up.",2,DuneRaccoon,dxkcks4,2018-04-18 12:56:05,12,1
Yougling hunt FTW ,2,Clone12319,dxka5xc,2018-04-18 12:01:38,12,2
"I’ve played a few games and I genuinely enjoyed it.  I’m really glad that you guys give those new emotes to both the stormtroopers and ewoks!  One minor thing that I’m assuming is unintentional is that when my buddy became an ewok and he used the flair thingy, he showed up green instead of red on the mini map.  Nothing major but it does make me want to hunt him down haha",2,Anakinhatesand,dxk9bk3,2018-04-18 11:39:44,11,1
FPS view seems (imo) better in Ewok Hunt than in other modes. ,2,Hive51,dxk9c4d,2018-04-18 11:40:09,11,1
"A fantastic addition! Really fun and refreshing. Please make this a permanent mode! And expand on it in the future.   As for the people complaining about the cave, maybe make it darker, or turn off the torches? Think of how scary that cave would be in pitch black with only a flash light.   Good work, DICE! ",2,J0hnn2049,dxkb361,2018-04-18 12:23:42,12,1
"If you think you’re safe from me in the cave, you’re wrong. Once fellow ‘woks notice all of the entrances, your chances of survival in there will dwindle.   This game mode is an excellent change-up as a way to keep BF fresh. The darkness is used so well, and I highly urge you all to wear headphones for the maximum effect of this freaky forest. ",2,JLTopkis,dxkdvt7,2018-04-18 13:21:29,13,0
"Its a nice mode, but the stormtroopers can fortify themselves in the cave easily",2,david19979,dxk98ok,2018-04-18 11:37:28,11,12
Here some feedback. This game mode is fucking awesome.,2,Kiryuin1990,dxkzwh4,2018-04-18 18:51:56,18,0
"would be nice for ewoks to get gliders that can be used on some bridges. and the jump attack seems a bit unreliable sometimes. the mode feels and plays great, and i hope to see it on other maps with different species.  also, more randomised pickups. currently they are always in the same spots. maybe some different pickup types and locations would be nice. and it would be fun to have ewoks as reinforcements on endor and flashlight as a star card or weapon mod.",2,superjediplayer,dxk98p1,2018-04-18 11:37:28,11,2
It's awesome! Makes this permanent! (And not jetpack cargo),2,jamiestglynn,dxk9d32,2018-04-18 11:40:54,11,2
"Hilarious and intense mode at the same time! I encountered a glitch at the end of one of my matches where a stormtrooper and I (an Ewok) were stuck on the edge of the map unable to move, and he was unable to see me. Other than that, ridiculously fun and I hope to see more modes like this in the near future!",2,Triz007,dxk9gbv,2018-04-18 11:43:21,11,0
"My vote goes to ""party games"" playlist!",2,PM_ME_YOUR_MONTRALS,dxkik68,2018-04-18 14:39:31,14,0
"Please make permanent. This is the most adrenaline I've had in this game, even better than finally unlocking epic tier on a character",2,bcarsonification,dxkhkxm,2018-04-18 14:24:16,14,1
"Super fun. I agree that they should make it permanent and add other themes. Just call it “Hunt”. Have wampas on hoth, maybe throw luke  in there somehow. Tuskan raiders on tatooine.",2,FartingTriangleChoke,dxkbo2w,2018-04-18 12:36:48,12,0
"I'm enjoying how most people are utterly confused at the beginning and it's made for interesting matches. I think as people figure it out over the coming days games will be a lot closer but that's a good thing. Having a lot of fun in this mode, could see it becoming a permanent thing with maybe more maps and such.",2,tinylegumes,dxk9b1d,2018-04-18 11:39:20,11,0
podracing pls,2,Qussan,dxkk6w5,2018-04-18 15:04:04,15,0
"The immersion of being stranded in the forest is fantastic! And the idea is very unique. You guys did great on this. One thing I would add is some Scout troopers with scout pistols because I think they would look awesome on that type of scenario. The Ewoks are surprisingly good. The abilities were great and they even have emotes! The Ewoks should be added as reinforcements for GA (on Endor). Dice please make Hunt a permanent game mode on Battlefront 2. It has so much potential not just on maps already in the game, but on future maps as well. Here are some Hunt ideas for maps already in the game. https://www.reddit.com/r/StarWarsBattlefront/comments/8c2hz0/future_of_hunt_mode/?st=JG59RRN1&sh=93e09176  Overall Ewok Hunt is great. You guys did an amazing job on this! Cheers and Yub nub!   Thank you.",2,NinjaShadow111,dxkp6lm,2018-04-18 16:16:38,16,0
"Please consider requests to ""Make this permanent"" a sign of too soon to tell, but very positive feedback that the team made a fun mode!!!  JPC was fun the first time, until the second release on Bespin.  Let people play for a bit before locking anything in.  However, the requests for Private matches (for ALL game modes including the event ones). Absolutely start considering how to implement that for the next update.  Thanks. ",2,XBOX_Strategizer,dxkcibd,2018-04-18 12:54:42,12,1
"Ewoks sprinting forward are slower than an Imperial just walking backwards. One roll from a trooper, and he is so far away, you cannot reach him, because he shoots you down in that short amount of time.   It takes like 6 or more staff strikes to kill someone, using the Horn makes little difference, it gives away your position more than it gives you a buff.  Survival instinct is broken, I don't understand how it's supposed to work. Sometimes it gives me wallhack, sometimes it doesn't give anything, not even the footprint tracking.  In game (green) party outlines still show when you are on opposing teams.  That fairy grenade is the most no skill ability since Rey's Mind Trick. It is not clear that it works like an incendiary grenade, so it has a fix AoE, once you leave that, the fairies leave you alone. However while inside, you have no defense against them, rolling doesn't help, and the fact that Ewok attacks are worthless as stated above, the only thing they can do is spam the fairies, to annoy the troopers.   It seems like a fun tactic for the entire imperial team to camp inside the cave, however two ewoks have no chance of killing anyone in there, doesn't matter how many flanks the cave has. After many matches the imps always end up camping in the cave. The only time we leave is when we are so OP, we don't need to camp against the Ewoks.  The heavy gun has infinite flashlight. I don't think this is intended, but then again Iden's emotes aren't working since day 1, so who knows. I'm okay with it having double, or even triple the battery than a normal gun, but having infinite battery makes the mechanic pointless for the starting weapon.   Suggestions:  - make Ewok attacks stronger, 2 hit kill with battle cry, 4 without, and 3 with fairy damage combined.  - it is Ewok home territory, make them faster, jump better so they can navigate terrain better. Ewoks should be able to climb rocks the Imps can't, however as of right now it's the opposite.  - encourage imperials to be on the move, and not camp inside the cave (don't punish, encourage, eg: get bonus credits for passing random checkpoints around the map or collecting remnant tech from the Endor garrison)   bonus score won't do, Level 50 player don't get score anyway, but credits are very valuable now ",2,alexaka1,dxla14a,2018-04-18 21:21:37,21,1
"We need Hunt as a permanent game mode. It'll only help the game grow. There are many possibilities for this, like Wampas, Gungans, Sand People, Wookies, Genosians, Order 66... Just gotta make sure to get them right and allow us to at least level up while playing this, even if we wouldn't be able to use cards there.",2,Comand94,dxkh1qq,2018-04-18 14:15:27,14,0
Proximity voice chat from Stormpoopers please?,2,Ey_b0ss_,dxktivp,2018-04-18 17:18:56,17,0
"General feedback:  * The atmosphere is amazing. Totally nailed the almost horror-esque feeling of being hunted as troopers, and the predatory feeling of playing an ewok is awesome.  * Caves should have another entrance from above, once troopers realize it is there usually it only takes one person covering it to keep the ewoks out.  * Pickups should be random. The rush to grab them at the start is reminiscent of the pickups of swbf 2015, and we all know how the community feels about those... * The pickup themselves is great, love the improved flashlight and weapon, the grenade is awesome too.  * Its tough to land the aerial attack as an ewok, seems like the hitbox is really tiny? Or maybe I just need practice. Some sort of glider would be amazing.  * There should be some counterplay to the lights in the cave system. it would be nice as an ewok is the wisties could put out torches, or something. Maybe give the ewoks a water balloon type pouch thing, that functions as a pickup in the swampy area and puts out torches when tossed at them. Can you imagine the fear in the heart of a stormtrooper as he watches the torches around him go out, one by one?  * It would be nice if there was a delay between when the ramp lowers on the ship and when troopers can board. Every game I've played where the the troopers have survived until the end, they are able to board immediately after landing with barely any ewoks being able to arrive in time to even attempt to stop them.  * A timer, similar to the galactic assault timeline at the top of the screen that shows progress, would be nice to show the arrival of the ship.    That's all i can think of for now. Love the mode so far, can't wait to play with friends later tonight. ",2,menofthesea,dxlkvo2,2018-04-19 00:22:34,00,0
"Just played, Ewoks getting to the ship early is key.  The cave is too lit up.  Troopers camping like crazy.    Suggestion: speed up the Ewoks a bit, darken the cave.  ",2,Pontifex333,dxllgmc,2018-04-19 00:31:58,00,0
- Make it permanent.  - I'm down for more Hunt modes.  - This would be fantastic for private matches.,2,RadioJawa,dxkdq79,2018-04-18 13:18:33,13,0
THIS IS A BEAUTIFUL GAME MODE!! (Would love more epescially an Order 66 with the Jedis on brink of extinction against the clone army),2,El_Tomahte,dxke7i5,2018-04-18 13:27:26,13,0
"Awesome mode, love it. Add it to Arcade though please! Would love to play it split-screen.   Also, would love to see Wampas vs rebels on Hoth or Jedi vs clones in the Jedi Temple during Order 66.",2,Indy201,dxkpu7o,2018-04-18 16:26:00,16,0
"In the name of father 🙏🏼 Please make this permanent, its too much fun. OR just make Ewoks a special class for the rebels, I fucking love them. ",2,Fightologyy,dxktn0q,2018-04-18 17:20:37,17,0
Ewok spear needs more damage ,2,Cerbierus,dxkc46h,2018-04-18 12:46:29,12,3
"The atmosphere is great, keep that for future content. The way the troopers have to use their flashlights is just great.",2,LCH_Ace,dxkcsz8,2018-04-18 13:00:44,13,0
"Maybe make a bunch of stuff like this: ewok/stormtroopers/droids/clones/rebels, and shuffle the modes once in a week. ",2,Kaquillar,dxkq5kx,2018-04-18 16:30:32,16,0
The caves needs a nerf.,2,Kaathe-Darkstalker,dxlbxxe,2018-04-18 21:51:36,21,0
"Few things: *Make it permanent *Give the storm troopers a timer (but not the ewoks, gives both sides a sense of urgency) *Give the ewoks a take down from above option (Arkham style) *Clarify how the storm troopers win, maybe have the transport circle a little longer to keep them moving. A few of the games I've played the storm troopers have one even though the transport is covered in ewoks and the troopers are nowhere close. They should have to be near the transport far a short while to win, similar to capturing a location of GA. *Maybe make the storm troopers able to destroy the platforms with blasters. Definitely make them able to destroy traps with blasters (This is kind of annoying that they can't. *More variations (disarmed wookies vs storm troopers, rebels vs wampas, storm troopers vs tuskens or jawas)",2,NowhereMan-9-7,dxklzv6,2018-04-18 15:30:35,15,0
More detailed Ewok party cutscene please! Jumping\dancing ewoks on trees at least,2,gotalight7,dxknwd5,2018-04-18 15:58:01,15,1
Also I think ewoks need to be little faster that troopers,2,gotalight7,dxkofcs,2018-04-18 16:05:39,16,0
When you get out of bounds the imperial officer says : check your objectives! Wich is very out of place. ,2,robertgamer250,dxksxio,2018-04-18 17:10:22,17,0
"Stormtroopers should only have access to the E-11 blasters and nothing else. When someone picks up a DC-15LE it tilts the odds in their favour to much. Also troopers melee needs a reduction in damage, so that it takes three hits to kill and Ewok instead of the current two.  Ewoks Wistie could do with a slight reduction in its ability to track enemies and in it's attack duration.",2,penhead455,dxkygui,2018-04-18 18:31:04,18,1
Is the cave ruining the mode? ,2,Darktronik,dxl8w5w,2018-04-18 21:03:51,21,1
"I played a few rounds as stormtroopers without dying (or dying at the end), but eventually wanted to play as ewoks... maybe if players could volunteer to start as ewoks, that might be better than random selection.",2,feriwan,dxk9paw,2018-04-18 11:49:59,11,1
"It's fun but the cave removes all the intensity. No need to worry about Ewoks falling from the sky, traps or even the darkness when you can just sit and watch an entrance for 5+ minutes. It makes every game very predictable and samey as well.",2,Gundalfus,dxk9bqy,2018-04-18 11:39:53,11,4
"Love it! only issue I have... and it's small is the ""player lost to the forest"" is too bright and right in the field of view. My old eyes have a hard time seeing around this.  Very nice job! ",2,MyLegFeelsFunny,dxkadcn,2018-04-18 12:06:42,12,0
I’d like to see Jawas vs Tusken Raiders as well!,2,dannytortellini,dxkawea,2018-04-18 12:19:24,12,0
Spawned me in on a trap so lost 100 hp right away :(,2,OddM3dic,dxkk6wu,2018-04-18 15:04:05,15,1
"Personally, the gamemode is very enjoyable but I think the base ewok attack is a little too weak. I hit someone 8 times in a row when they had no idea I was coming and they turned around and killed me, being left with 40 health. The horn does help mitigate this but I personally feel like the active time could do with a 1-2 second duration buff. Otherwise, I think it's very fun and I would definitely like to see similar modes in the future",2,Stoneagelabs,dxk9csf,2018-04-18 11:40:41,11,1
The falling trees and noises when a grenade goes off is so awesome. The flashlights are also ready cool.  The only thing that would be cooler would be different emotions and maybe different maps of this game mode. Jedi vs stormtroopers would be so dope. ,2,dontbereadinthis,dxkhx88,2018-04-18 14:29:40,14,0
The fact you have to get kills and not just assists is a bit frustrating for the challenge.  Maybe something about stopping the cave camping every game? I'm not sure how to make it balanced but it seems very repetitive as that is all people seem to do.,2,Andigaming,dxkcwy3,2018-04-18 13:02:55,13,1
I don’t think “focused feedback” means “make it permanent.”  That’s the opposite of focused.,2,jjameson2000,dxkikpi,2018-04-18 14:39:44,14,0
Make the mode permanent with limited time variations. ,2,Trysotope,dxkaud3,2018-04-18 12:18:06,12,0
"Instead of making the little game modes as limited time modes, could we get a playlist of all those modes ?  For example : 3 or 4 rounds of night on Endor then 1 round of jetpack cargo and so on... ",2,leow193,dxkcgr9,2018-04-18 12:53:47,12,0
I really love it dice. PLEASE PLEASE KEEP IT,2,namesflory,dxkft7e,2018-04-18 13:55:09,13,0
Voice chat.,2,JohnnyRico117,dxklf2a,2018-04-18 15:22:14,15,0
"I really hope this is the start to a new Hunt game mode which will be added to continuously.   Also, Ewoks should replace Wookiees on Endor. We have the technology, and if this game mode doesn’t stick around, it’ll be such a waste of an Ewok model + weapons and abilities ",2,Moldeyawsome12,dxktd2c,2018-04-18 17:16:35,17,0
Needs to be permanent and needs to be expanded on. Im so very surprised how well done it actually is,2,JVanzandt,dxktyq8,2018-04-18 17:25:13,17,0
"imo the cave really needs to go, an easily accessible fully lit easily defendable position takes away everything fun about the game mode. It just becomes spread out and heal when you get hit by flies.  EDIT: EXTREMELY hard to coordinate as ewoks with no voice chat, also make the ewoks faster the stormtroopers can literally walk backwards and shoot you and there's nothing you can do about it. Would also make the ewoks take 3 shots to down instead of 2 and maybe make the spear do 5 more damage. Also if you really must leave the cave accessible, don't give the stormtroopers such a good line of sight to it, make it more angled so they can't just aim directly through the passage.",2,King_Abdul,dxku6gk,2018-04-18 17:28:19,17,1
"Love the mode. Brings back memories of playing infection on Halo.   This mode should be a permanent standalone mode called “hunt” with variations on different maps like sand people hunting jawas, ewoks hunting troopers, clones hunting Jedi (order 66), first order hunting resistance (through crystal cave for example), etc..   Also I’m loving the restriction of 1st person only. Makes me want a 1st person mode too",2,seelay,dxkx3vx,2018-04-18 18:11:08,18,0
It would be lovely to see other maps get a hunt mode.,2,tupe12,dxl15ji,2018-04-18 19:10:22,19,0
Please add Ewok as reinforcements or Wicket as a Hero.,2,AverageUser13,dxl5vgr,2018-04-18 20:19:11,20,0
"I love this mode. If I had any complaints at all it would be that the Ewoks are, over all, too weak, both in offence and defence and the ability to see more clearly doesn't offer enough of an advantage to make up for it,  and that it's near impossible to win as the Ewoks if the StormTroopers can manage to hold up in the caves early enough in the round, as there is simply to many to kill before the shuttle arrives.  Aside from that though, the mode is a ton of fun and I hope it's here to stay, with some QoL changes.",2,Spike6958,dxldapw,2018-04-18 22:13:32,22,0
Needs more then one hole in the roof. If the storm troopers get to the cave before you can pick 2-3 off then it’s impossible to win. It’s way too easy for a competent group of storm troopers to defend the cave plus it’s way too bright in there.  Would also be nice if spears did more then like 20 damage a hit or if it had increased damage to the back,2,Obi_Wan_Gebroni,dxlwz70,2018-04-19 03:50:47,03,1
"I was a bit skeptical about this when I heard about it, 'cause I'm not a fan of ewoks, but oh my gosh is this fun.  PLEASE make this a permanent addition.  I'd definitely be on board with more night terror maps",2,donut_holeschtien,dxlxrzx,2018-04-19 04:06:33,04,0
I think Ewoks need a better way to communicate. Troopers are able to work together much more effectively because of all the ways they can communicate with each other. Lights. Blasters. Emotes. I think it would solve the cave problem people are talking about too. That shit is still soooo fun lol. Favorite game mode for sure,2,badkneegrows,dxlxsu2,2018-04-19 04:07:02,04,0
I seriously laugh out loud whenever ewoks do their victory emote whenever they kill someone.,2,Fandangbro,dxm4222,2018-04-19 06:49:48,06,0
The gamemode is great but I would love to see the Ewoks as reinforcemts in other modes,2,carsonfrench,dxk9j0c,2018-04-18 11:45:20,11,0
I dont think camping in the cave is a problem since stormtroopers have to get to the evac ships anyway,2,robertgamer250,dxkskom,2018-04-18 17:05:14,17,0
"Also, sometimes the eliminations earned in game don't show up for me on the scoreboard.",2,greenearbud,dxkcy31,2018-04-18 13:03:32,13,0
I havent played yet but i read alot about the cave thing and stormtroopers camping.   How about making 1 or 2 small entrances for Ewoks so they can sneak in or something like that,2,Tummerd,dxkf6ny,2018-04-18 13:44:36,13,1
Make hunt permanent. Use it as the framework for Order 66 mode.,2,TopKat_15,dxkguzs,2018-04-18 14:12:22,14,0
"It's not entirely related to Ewok Hunt, but in the last Battlefront I felt there were far more smaller game modes that had objectives unique to the mode. I think it was Blast that came out with the Bespin DLC, I played it for hours and it was so fun. Smaller modes with unique styles of play are what I enjoy the most, hope we can get more. ",2,totallynotliamneeson,dxkhjdc,2018-04-18 14:23:33,14,1
"I'd like a playlist that mixed a bunch of these limited modes in the kind of way that Halo did the Action Sack playlist.  Game mode is fun, but because of the lighting and defensablility most people will go into the caves as stormtroopers which can be kind of degenerate. Most zombie modes have an area where people tend to clump up and it is still way to early to tell if it's a problem but maybe think about removing a couple torches in the cave will help",2,drsempaimike,dxkipx2,2018-04-18 14:41:58,14,1
its fun but most of the time all stormtroopers are just running to the caves and most ewoks dont know how to get them out of there. ,2,heAd3r,dxkj54v,2018-04-18 14:48:25,14,0
"Only played 2 or 3 games, liked what I played.  Has a great foreboding feel to it.  Main gripe is that it felt really slow with lots of time just wandering around waiting for something to happen.",2,danclyro_gaming,dxkjqt5,2018-04-18 14:57:24,14,0
"My only problem is that it takes 5 hits to take out a stormtrooper, even if you attack them from behind, they still have an advantage over you",2,Emperor_Palpamemes,dxkkyji,2018-04-18 15:15:31,15,1
Make it permanent. I love it so much and it really immerses you in what it'd be like to be a trooper stuck with deadly killing machines hunting them down. Something like this with rebels trapped on hoth being hunted by wampas or Jedi on with nothing but a saber being killed by clones would be great,2,Eefy_deefy,dxkou45,2018-04-18 16:11:39,16,0
Ewok reinforcements for endor,2,Echo-Akira,dxkpamf,2018-04-18 16:18:15,16,0
"Sometimes, depending on where I look my screen gets almost completely white, and not the someone shines a flashlight in your face kind of way but really glitchy and flickery pure white with weird circles of white around the big blob of white. It's making me hate playing as the stormtroopers tbh.I assume this is a bug. I'm playing on DX12 with an AMD GPU.    Besides that please make it easier for the ewoks to get into the cave, right now it's really hard to not win as the stormtroopers if enough people camp the cave.",2,IKraftI,dxkpw92,2018-04-18 16:26:50,16,1
