Body,Thread_FK,Author,Comment_id,Date and Time created,Hour created,Num_Replies
"Lightsaber combat feels fantastic now with the new hit timing, also i'm pretty sure they added more sound to the hits, also nighttime Naboo! atleast in arcade A bug however: Helmetless iden has Finns Voicelines when entering battle",1,Arouga,dxk67b7,2018-04-18 09:55:10,09,7
Small bug I’ve noticed: Helmetless Iden has no facial animation during emotes,1,R97R,dxkang2,2018-04-18 12:13:34,12,2
"Prices for skins:  Common: 5,000 credits, 150 crystals  Rare: 20,000 credits, 500 crystals (5 dollars)  Epic: 40,000 credits, 1000 crystals (10 dollars)",1,DownvoteThisCrap,dxk42ug,2018-04-18 08:30:02,08,10
Wish you would stop with the limited time events and just add them permanently there’s not enough variety as is,1,ANY_MIDORI,dxk9qnh,2018-04-18 11:50:55,11,3
"I think that the overall skin prices are reasonable, but I have an issue with them only unlocking on one faction. If you want to use the twilek as both Resistance and Rebellion, you need to unlock it for 20k twice. This seems a little much.",1,Basesandboards,dxkb4r4,2018-04-18 12:24:43,12,6
Ok im surprised at how good ewok hunt is. ,1,Decado7,dxk8eqf,2018-04-18 11:13:17,11,4
I just noticed that Infiltration no longer marks enemies on the minimap like it's supposed to. I tried both the basic skill and Hardened Infiltration and I'm getting the same thing. Anyone else experiencing this? (PS4),1,edge-inc,dxkho3v,2018-04-18 14:25:39,14,2
Add Giant Spiders to the caves to drive the Stormtroopers out and into the open!,1,ZenDude15,dxkrafs,2018-04-18 16:46:51,16,2
Changing crafting parts into skill points do not level up the units right? It only upgrades star cards ,1,LorenzoVi,dxkh9u4,2018-04-18 14:19:16,14,1
Playing as an ewok now resets your enforcer star cards to only the explosives expert card lol.,1,Innocentgrin,dxkuccn,2018-04-18 17:30:41,17,3
"Ewok Hunt is actually a pretty fun mode.  However, random internal scripted radio chatter among troopers would have added to the whole empire ""immersion"" factor.  Playing the mode reminds me of ""A Quite Place"".    The character customization aspect is extremely sparse given the vast amount variety that is avaible to work with, especially in the hero department.",1,Doomslayeer,dxkf8fx,2018-04-18 13:45:26,13,1
[Horns tootootootooooting,1,Ryry1573pornaccount,dxk3l0k,2018-04-18 08:10:47,08,0
Real fear will come after eliminating caves on Endor,1,josecarlosleonu,dxkcbza,2018-04-18 12:51:01,12,1
If Rey and Fett get assists off of revealing enemies so too should the specialist while using Scrambler Infiltration. ,1,__RogueLeader__,dxkji2s,2018-04-18 14:53:50,14,0
EWOK Hunt challenge are available! (still waiting for the update) ,1,j_cxa,dxk3vin,2018-04-18 08:22:05,08,0
Nobody appears on radar anymore except heroes. That’s a nasty bug,1,WVgolf,dxkgt03,2018-04-18 14:11:27,14,4
"Yeah, I'm not a fan of the caves. A lot of the intensity is lost when you're forced to babysit an entrance for over five minutes.",1,Gundalfus,dxk7eiz,2018-04-18 10:40:10,10,1
"Cheers and Congratulations on the fantastic update! Yub hub!   Ewok Hunt- You guys did amazing on this! The idea is extremely unique and the immersion of being stranded in the forest is fantastic. The Ewoks are surprisingly good, they should replace the Wookies on GA (only for Endor). Hunt should definitely be a permanent mode on Battlefront 2 because it has so much potential not just on maps already in the game, but also for future maps.   Here are  some Hunt ideas for maps already in the game. https://www.reddit.com/r/StarWarsBattlefront/comments/8c2hz0/future_of_hunt_mode/?st=JG59RRN1&sh=93e09176  Skins - The Hero skins are great. Can’t  wait to see more of the iconic looks from the movies! DICE please reconsider gender/species locking for the trooper classes. I don’t understand why is that a thing in Battlefront 2. You guys should aim for what you guys did on Battlefront 2015, which was great trooper customization. Also, the prices for skins were reasonable so I have no problem with that. Skins have great potential so don’t be afraid to go all in (while staying canon of course). It feels great and refreshing seeing different skins in a match.   Overall this was an awesome update in my opinion. Can’t wait to see more!   Thank you. ",1,NinjaShadow111,dxko8f8,2018-04-18 16:02:51,16,1
Is it just me or do the Iden emotes still not work?,1,lSecretAsianManl,dxkejxq,2018-04-18 13:33:39,13,1
"This game is super fun. Maybe a few balancing tweaks but overall it’s a keeper. Add more hunt modes with  Wampas, Sandpeople, Jawas, Gungans and id play this quite a bit.   Also love the credits that you earn, makes up for lack of skill points earned.",1,Coletronm,dxkuin5,2018-04-18 17:33:14,17,0
Seemingly no option to purchase skins,1,BelieveInTheShield,dxk3udh,2018-04-18 08:20:51,08,1
Just pulled the patch. Now it won’t launch.   Anyone else on pc running into this?,1,themahi,dxk409w,2018-04-18 08:27:16,08,0
"Intermittent spawn bug, not letting people spawn, only happened to me in GA so far and a few others, stuck in spawn screen cannot do anything but alt+f4.",1,Keakaha21,dxkasvg,2018-04-18 12:17:07,12,0
Can confirm Rank 50 trophy is still broken. Played a round earlier and no good. Stunning. ,1,Andrea9281,dxkvzcz,2018-04-18 17:54:30,17,4
Game crashes !!!  (when inviting friends on menu)  Would love a fix for this,1,Tal-Kara,dxl55ul,2018-04-18 20:08:50,20,1
Does anyone know if crates contain skins?,1,KOFOLA007,dxk534w,2018-04-18 09:10:11,09,2
"Ewok gamemode:   * Hilarious! Love to see some other kind of 'battlefront'.   * More classes would be cool.    * The map needs some makeover, or the stormtroopers need some incentive to move around. Currently, players always gather in the cave. This basically causes the chokepoint mess from GA to appear in this gamemode. Endless ewok grenade throwing instead of preying in the dark.",1,Diff_sion,dxkad9k,2018-04-18 12:06:39,12,0
Are we going to have a time frame to spend our crafting parts?   I want to use them for my hero starships but since I haven’t reached level 25 for most of them I’m saving the crafting parts for that moment and I’m not sure how long that is gonna take ,1,Franz_McN,dxko3d1,2018-04-18 16:00:46,16,0
Any update on the Rank 50 achievement/trophy bug?,1,Rafficus-III,dxkrmgd,2018-04-18 16:51:38,16,1
"As someone who got boned by unlocking every single hero character and ship instead of spending credits on crates (I joined after xmas), I thought at least my crafting parts would go to good use.  Not having the crafting parts to used to increase the level of the character means I have thousands of crafting parts but still can't upgrade cards to the third or epic tier until I grind grind grind with that hero in HvH at which point I would have earned the skill points anyway.  This is .... frustrating.",1,karmichoax,dxl5ivn,2018-04-18 20:14:04,20,1
Game crashes on Xbox One mostly on menu. ,1,VaultTec_Dovah,dxl96ep,2018-04-18 21:08:19,21,0
What is the cost of crystals?,1,CulDeSax,dxkk81u,2018-04-18 15:04:33,15,0
My game keeps crashing every time I go to the Social Hub to try and set up a group. Does anyone have a fix for this? This has been a problem since the last update. ,1,Metzelda,dxkybv3,2018-04-18 18:29:01,18,1
I'd like to see more skins to change the gender of the classes and a way to change your skin before a match starts. I want to be able to use Hoth Luke on Hoth instead of playing on Hoth and being stuck with Jedi Luke,1,SmRndmGeek,dxl6v7v,2018-04-18 20:33:36,20,0
"BUG!  I’m pretty sure Darth Maul’s throw is still broken. Admittedly, it is not as broken pre-patch it will actually register SOME throws but sadly not all...   Anyone else had a chance to investigate? ",1,Dannehkins,dxkc1o6,2018-04-18 12:45:02,12,2
Ps4 needs It now Its 3am here lol,1,Aj_bary,dxk3k1m,2018-04-18 08:09:47,08,4
"While I appreciate we finally have customisation, I think it could do with some more variation using what's currently in the game.  1) Have the appearances universal between most factions. There are some races or heads I'd really like to use on Assault but they are locked for Heavy.  2) As well as being able to purchase skins directly, let us also unlock them through challenges.  3) Ewok Hunt is fun, and I'd very much like to see the same mode for other eras or maps, like Hoth. Wampas hunting Rebels.  I'm very mixed on Clone skins. I know people would love to play the 501st, but the skins do represent legions and it would be weird seeing a mix of them in one battle. So for now I'm not too fussed, but it would be nice if we could edit individual pieces on our classes like weapon holsters or camo pattern.",1,JuicerJames,dxkch2f,2018-04-18 12:53:59,12,0
So Ewok Hunt is awesome.,1,GoofyGooba88,dxk6o1y,2018-04-18 10:13:13,10,0
Pretty pissed that they removed skin options instead of adding them.  Here is the rebel assault options now: https://cdn.discordapp.com/attachments/330822032097017856/436094667784978435/unknown.png  And here is what options we had at launch: https://cdn.discordapp.com/attachments/330822032097017856/436094754602614785/unknown.png  Rebel heavy now: https://cdn.discordapp.com/attachments/330822032097017856/436094950678069250/unknown.png  Rebel heavy at launch: https://cdn.discordapp.com/attachments/330822032097017856/436095200243351557/unknown.png  Rebel specialist now: https://cdn.discordapp.com/attachments/330822032097017856/436095078587695104/unknown.png  Rebel specialist at launch: https://cdn.discordapp.com/attachments/330822032097017856/436095338567434250/unknown.png  Rebel officer now: https://cdn.discordapp.com/attachments/330822032097017856/436095288206426112/unknown.png  Rebel officer at launch: https://cdn.discordapp.com/attachments/330822032097017856/436095634735497216/unknown.png  Obviously clone legions are missing too but the above images are just examples.,1,FaintMelodyOfLight,dxk5ou5,2018-04-18 09:34:27,09,5
"Skins are pricey, but expected. Atleast it's something to work for and give motivation to play. ",1,Bones_2450,dxk4gsw,2018-04-18 08:45:22,08,1
New glitch where kylo cant block,1,DWill23_,dxkpzaa,2018-04-18 16:28:02,16,0
Ewok hunt is brilliant please make it permanent,1,copevortex,dxkvj8b,2018-04-18 17:48:01,17,0
"Ps4 bug with hero's still doing ""the running man"" meaning running extremely slow",1,N7whiterose,dxl4dg9,2018-04-18 19:57:10,19,0
"Darth Vader still buggs out for me and gets stuck in the choking animation, can't do anything but walk around slowly with his hand raised. This is super frustrating as you just get picked off by the nearest enemy player.",1,PolishWasabi,dxl85ny,2018-04-18 20:52:39,20,0
The trooper skins are too expensive imo. hero prices are fine though.,1,Orion920,dxk5kq6,2018-04-18 09:29:51,09,1
"The thing with appearances that I hate, is that there are no clone appearances. Those are like the only appearances that are worth buying or obtaining ",1,EA-is-cancer,dxkbcud,2018-04-18 12:29:51,12,1
Downloading on PS4 230 am in cali,1,thedavidsystem,dxk5o80,2018-04-18 09:33:46,09,0
"For those of us currently at work, can we have some hero skin price listings?",1,Marawd3r,dxk5z9t,2018-04-18 09:46:20,09,1
"Anyone experiencing problems with the patch, restart whatever system you're on. PC restart origin, consoles fully shut down and restart your system, you should be able to buy skins/convert CP to SP afterwards. Hope this helps",1,thevironis,dxk7trl,2018-04-18 10:54:29,10,0
Infiltration is broken. Doesn't spot enemies anymore with the exception of Scramble.  Confirmed bug. ,1,metalsnake27,dxkooto,2018-04-18 16:09:30,16,0
HvV credit spinners are back. PS4,1,Bomb82,dxkpluj,2018-04-18 16:22:40,16,0
HvV spawns are messed up. Constantly spawning right in front of enemies or in battles and being attacked before even being able to move. ,1,TheeJamesT,dxkvgyq,2018-04-18 17:47:06,17,0
"Some of my star cards got reverted back, and I've unlocked them through game play, but now I have to unlock them again. Anybody else experiencing this problem? ",1,Boombr034,dxl1aod,2018-04-18 19:12:27,19,0
"So do I have to convert all my crafting parts 40 by 40? I have almost 6000 crafting parts, this will take a while",1,ethanhawkman,dxl1jsu,2018-04-18 19:16:08,19,0
Boba's gun stops firing (ps4) had a game on naboo where during the final round his gun simply wouldn't fire. Everything else worked fine ,1,N7whiterose,dxl2wuo,2018-04-18 19:36:01,19,0
Ps4 bug. Pressing x doesn't work on the menu sometimes at all. The only solution is to close the game and reopen ,1,N7whiterose,dxl2ysu,2018-04-18 19:36:48,19,0
"So while playing as a hero with continuous music on it plays a specific theme for them, correct? ",1,Kozzer33,dxl4cl1,2018-04-18 19:56:49,19,0
Lightsabers sometimes not appearing ,1,N7whiterose,dxl4ga1,2018-04-18 19:58:18,19,0
Infinite black screen after playing GA and exiting  (ps4) ,1,N7whiterose,dxl57hy,2018-04-18 20:09:30,20,0
Cave camping is already a problem lol ,1,Beardgang650,dxl6onl,2018-04-18 20:30:55,20,0
"""Fixed Vader getting stuck in the force choke animation""  And yet I had never encountered it until after the update and spent a good minute walking around showing everyone doing my best crab impression with my left hand. Seriously, I only got stuck in it after the update, never even seen it before. ",1,GruntChomper,dxl906b,2018-04-18 21:05:36,21,0
Ps4. Frenzy strike for Kylo do NO damage sometimes. Force Abilitys still not working all the time as intended (vaders choke not working properly) ,1,N7whiterose,dxl98fv,2018-04-18 21:09:13,21,0
"I kept getting disconnected from ea when trying to load up the game, spent a solid hour trying to get connected to the game servers when I had fine internet connection. Also I eventually loaded in a few times but every-time i would be loading into a game then it would load me into an empty lobby then disconnect me from the ea servers and I would get the same error message- deeply frustrating ",1,slid125,dxl9qlp,2018-04-18 21:17:01,21,0
"I spawned in as a Resistance Officer in the Arcade mode (Team Battle Takodana) with the Abednedo Officer skin equipped. It showed me the default Resistance Officer, until I respawned through the options menu and chose the Officer again. ",1,greenearbud,dxlb71k,2018-04-18 21:39:46,21,0
"I can't Play the game (Xbox One) after this patch. Was able to play fine before this. I have tried hard resetting, and I still crash to dashboard right as the shows the Logo screen. Currently re-installing, hope it gets fixed. ",1,Pancake_Party,dxlc0p8,2018-04-18 21:52:47,21,1
Is it really a victory if ONE player survived?   Can we make it like 3 people minimum have to board the ship for a victory? ,1,Thetschopp,dxlolw0,2018-04-19 01:24:40,01,0
The selection of skins (or should I say faces) and gender locking is pretty weak.  Very underwhelming.,1,Dwarf_power,dxlt5zj,2018-04-19 02:41:31,02,0
Sometimes spawning as ewok when the extraction ship is on its way the red marker for the objective is not moving and then teleporting to the right place or just stuck somewhere. I accidentally ran on the opposite direction of the ship until I reached the border of the map because the marker was far away out of bounds and stuck there. Ewoks lost.,1,spookyspagetti,dxm1ffd,2018-04-19 05:29:56,05,1
"In the Ewok mode, the whole ""X has been lost to the forest"" message that's right in the middle of the screen is super distracting and annoying. ",1,UnwantedRhetoric,dxklyd4,2018-04-18 15:30:00,15,0
its pretty good,1,Swiftphantom,dxk3j5q,2018-04-18 08:08:50,08,1
When will Xbox one and PlayStation receive it? Like within minutes or hours?,1,vixypix,dxk3lcj,2018-04-18 08:11:09,08,4
Terrible. 6 months for face swaps that we had 3 years ago? What the hell have you guys been doing?! Not a single uniform change...? Talk about taking the path of least resistance. The wrong team is in charge of this game. Blunder after blunder. Failure after failure. The team has no passion for the franchise and they’re doing a bad job. 6 months of silence for this “update” (activated options from years ago) is enough to make that decision.   SO many other games have done this model with insane success. This team can’t look at any of the wildly popular games around them and see people don’t want face swaps...?   It’s just daft. ,1,BashfulTurtle,dxkcj5s,2018-04-18 12:55:11,12,2
Can we buy crates again now? If so what's in them? Emotes? Skins?,1,baddada77,dxk6cgz,2018-04-18 10:00:44,10,0
"Converting scraps into upgrade points is character specific but doesn't raise the character's level, meaning you can potentially have more uprgade points than you're able to spend if you're below the epic card level threshold. Bit of an oversight",1,slop_drobbler,dxlf4qo,2018-04-18 22:44:41,22,1
We NEED Ewok hunt permanent. Please. Just please.,1,Unresponsive20,dxlg7hl,2018-04-18 23:03:52,23,0
Do the wampa thing like everyone’s saying but use the mechanic where the wampa is weak at first and has to go around the map eating tauntaun’s which gives him more abilities.   Btw great job with the new mode dice!!,1,SymmetraQueen,dxlgq6o,2018-04-18 23:13:04,23,0
I am in love with this mode! Virus was my go-to in Time Splitters back in the day. Anything resembling it is a welcome addition!,1,ClydeFrog90210,dxli1qr,2018-04-18 23:34:50,23,0
"As an Ewok, I am confused by the ""Reach"" icon at the end of the round. I have seen it off in the distance straight ahead of me and had the Imperial shuttle land just over to my left... did not seem to be accurate.",1,Ringer7,dxljphj,2018-04-19 00:03:02,00,0
I just played a Heroes v Villains match on Bespin and the heroes team were all Luke Skywalker each with the different skins ,1,Sammmooooo,dxllgj1,2018-04-19 00:31:55,00,0
"I get pretty terrible stuttering at the beginning of every Ewok Hunt match, but only for the first minute or so. Then things smooth out and I consistently get 60+ FPS.  Edit: Honestly, after playing some of the other modes I get quite a lot of stuttering at the beginning of *any* match. But it always seems to smooth out after a few minutes. Don't know if it's a server side thing or what.",1,Mikey_MiG,dxllp37,2018-04-19 00:35:59,00,0
How do I get emotes now?  Also does the weird yoda glitch work in actual games lol,1,duckduckmcswagbadger,dxlnrb2,2018-04-19 01:10:32,01,0
The flashlight on the heavy pick up gun in Ewok Hunt is not correctly attached ,1,Kevstun,dxlnxci,2018-04-19 01:13:22,01,0
I've had my game crash multiple times when trying to access the party menu from the main menu. This is on Xbox One.,1,FoUfCfK,dxlnxxp,2018-04-19 01:13:38,01,0
It is entirely possible to jump up top in the trees as a storm trooper in Ewok Hunt.,1,DrPhil321,dxlnz9x,2018-04-19 01:14:13,01,0
No clone trooper skins or is that coming later?,1,Novaskelley,dxlp4ya,2018-04-19 01:33:24,01,0
Can Ewok hunt just stay permanently same with Jet Pack Cargo this is a lot more fun to me than GA by a country mile,1,PP_Horses,dxlprrv,2018-04-19 01:43:30,01,0
"This could all mean so much. I really hope you guys use Jabba or his Palace, hell, maybe even the dead Rancor.",1,Your_Next_Line_Is,dxlrbyy,2018-04-19 02:10:02,02,0
For the Ewok the valiant horn shouldn’t stop animation. The Ewoks would be more aggressive if they could sound while running. ,1,rnla70,dxlretr,2018-04-19 02:11:25,02,0
I love Ewok Hunt so much please make it not be a one time thing! I can tell you’ve put in a ton of work so show it off and keep it permanent or maybe just weekends or something like that. It’s my favorite mode right now. The horns are hilarious,1,wheatthin123,dxlrtim,2018-04-19 02:18:30,02,0
"Noticed a Yoda bug tonight where you stop absorbing blaster shots for his Unleash the Force ability.  The animation,sound effect, and cone were gone but the L2 (PS4) button did slow the character down to the walk if you were sprinting. Saddened to say, it cost me my life :'(",1,yelnum,dxlsuiq,2018-04-19 02:36:10,02,0
The Aqualish skin (bottom of the mouth specifically) clips into winter clothing. ,1,badkneegrows,dxlsx5u,2018-04-19 02:37:26,02,0
In Ewok Hunt if I run into a rock as an Ewok I sometimes get glitched inside the rock with no way to get out.,1,Hooper1725,dxlt4aj,2018-04-19 02:40:42,02,0
"Sounds and animations aren't synced during HvV intros.  Jerks still glitch into the lower section of bespin in HvV, only Fett can hit them. ",1,xyifer12,dxlun5p,2018-04-19 03:07:49,03,0
"If you have a competent group of storm troopers you will never lose in the caves as long as their is only one aerial entrance. Plus the caves need less torches, it’s way too bright in there.",1,Obi_Wan_Gebroni,dxlwr2y,2018-04-19 03:46:30,03,0
"Getting out of a vehicle, your skin is reverted to default. ",1,nicholasr325,dxm0cut,2018-04-19 05:03:31,05,0
"Bug? Snuck up and tried to pierce a trooper in the back, point blank. No damage with the first couple stabs, I think...  https://youtu.be/QtmptTayTwM  Sorry about my voice, heh. ",1,koryaiine1234,dxm0u34,2018-04-19 05:14:58,05,0
I unlocked dual zoom for the IQA-11on PS4 but it won't allow me to equip it.    EDIT:  I had the other two mods equipped on the gun in arcade.  After removing them I was able to equip dual zoom for multiplayer.,1,Rob_Nachos,dxm33lp,2018-04-19 06:18:43,06,0
One bug I've been experiencing on and off for some reason: hardened infiltration is not revealing enemies on my minimap with the specialist.,1,thebadsociologist,dxm431i,2018-04-19 06:50:44,06,0
"Sometimes while playing ewok hunt depending on where I look my screen gets almost completely white, and not the someone shines a flashlight in your face kind of way but really glitchy and flickery pure white with weird circles of white around the big blob of white. It's making me hate playing as the stormtroopers tbh.I assume this is a bug. I'm playing on DX12 with an AMD RX480 GPU and an i5 6600k playing on high-ish settings. It usually only happens when I am near other Stormtroopers who have their flashlight on.",1,IKraftI,dxm9c7c,2018-04-19 10:17:13,10,0
Has anyone had chance to test out Maul see if he’s actually fixed seen some people still complaining about his throw and not had chance to try out the new update yet also does his fool me once card finally work?,1,JethroTeal,dxm9wci,2018-04-19 10:37:41,10,0
"On Ewok Hunt as a Stormtrooper there's a lot of white particles/dots showing up, especially in the dark areas of the screen",1,JabroniSn0w,dxma39v,2018-04-19 10:44:25,10,1
"PC bug: Game crashes to desktop shortly after launch.  I see the splash screen and the ""globe"" thing in the top right starts showing lines, and then it crashes to desktop shortly thereafter.  Using a GTX 1080 and I updated to latest nvidia 391.35 to no avail.",1,Rouxmire,dxmfbhm,2018-04-19 13:00:36,13,0
"Matchmaking is still a pain. Got into a game full with stormtroopers and 2 ewoks. No one was playing the other modes, galactic assault had 2 players on lobby waiting! It was launch day, what is going on? ",1,Fenweldryn,dxmgyoj,2018-04-19 13:32:14,13,0
"I was playing Kamino on GA last night and ""East Platform Lost"" stayed on my screen for entire 3rd and 4th waves..it was kind of frustrating. Dont know if it's a recurring issue or not.",1,klist641,dxmh5wm,2018-04-19 13:35:53,13,0
Issue on Xbox that me and a friend have experienced several times: Opening the friend invite pan on the top of the screen crashes the game. ,1,RunFranks525,dxmt1z0,2018-04-19 16:41:00,16,0
Caves in Ewok Hunt need to be removed asap. Ruins the fun completely as Stormtrooper just hide in there.,1,ItsAmerico,dxk6thk,2018-04-18 10:18:59,10,1
"Ewok Hunt is fun and having customisable skins is cool but it doesn’t really matter to me because I’m fed up of the core game now. Until a mode like Conquest gets added, a FPS only setting is added and the weapons become more balanced, no amount of customisation will make me enjoy the game again.",1,AvadaKedavra31,dxkbce5,2018-04-18 12:29:34,12,0
Downloading on PC in Idaho 3am,1,MajikkijaM,dxk54ad,2018-04-18 09:11:31,09,0
Why have you made a lit cave-area in Ewok Hunt? It makes the game much too easy for the stormtroopers.,1,Walliii,dxkiqa7,2018-04-18 14:42:08,14,0
Tytyty,1,ylimani,dxkvtrw,2018-04-18 17:52:14,17,0
I count 39 infantry and 8 hero skins. They promised 40+ infantry and 50+ all together. This is bullshit,1,Jussari,dxk8v0h,2018-04-18 11:26:43,11,1
Still having no era selection option is super lame. The sequel trilogy maps are my least favourite and I hate everything about them.,1,__RogueLeader__,dxkgrzl,2018-04-18 14:10:59,14,1
[deleted],1,None,dxkcbzk,2018-04-18 12:51:01,12,1
How do you get to ewok hunt???,1,kinglyIII,dxkgj00,2018-04-18 14:06:58,14,1
Ewok melee should kill Stormtroopers in 1 or 2 hits.,1,AiringHouse,dxlhrvs,2018-04-18 23:30:19,23,0
Very underwhelming. A stacked disappointment. Skins are recycled garbage from the last game. Done with this build your to be let down.,1,Stephen_Cyborg,dxm1uo6,2018-04-19 05:41:32,05,0
Ewok hunt is awful. 5 months for that?,1,SkAblindside,dxkokmp,2018-04-18 16:07:49,16,1
"Would love to see simular mode with other creatures like Wampas, Gungans, Geonosians. Maybe even droids against Jawas :D",2,Fivetin,dxk98bi,2018-04-18 11:37:12,11,14
